Title,Location,Company,Salary_per_year,Summary
[STAGE] Traitement vidéo embarqué FPGA - Toulouse,Toulouse (31),LGM Group,None,LGM Ingénierie est une entreprise innovante dans le domaine de l’électronique embarquée et des moyens d’essai.
[STAGE] Développement d'un simulateur de capteur en FPGA pour train autonome - Toulouse,Toulouse (31),LGM Group,None,LGM Ingénierie est une entreprise innovante dans le domaine de l’électronique embarquée et des moyens d’essai.
[STAGE] Développement de briques VHDL sur FPGA H/F - Toulouse,Toulouse (31),LGM Group,None,"Dans le cadre de notre programme de R&T et d’innovation dans l’électronique spatiale, vous développerez des modules VHDL sur une nouvelle famille de FPGA…"
Techniciens en électronique,Évry (91),REFLEX CES,19440,A la recherche d’un nouveau challenge ?
Ingénieur Linux embarqué F/H,Villeurbanne (69),GROUPE CENTUM ADETEL,None,"Depuis plus de 25 ans, CENTUM ADENEO apporte conseil et expertise à ses clients dans le domaine de l’électronique embarqué."
SENIOR QA ENGINEER,Sèvres (92),Sept Lieues,None,Entreprise pionnière dans le développement et l'intégration d'architecture FPGA à destination des secteurs du spatial et de la défense.
INGÉNIEUR DÉVELOPPEMENT MATÉRIEL F/H,Élancourt (78),VIERLING COMMUNICATION,None,"Au sein d’une équipe pluridisciplinaire d’ingénieurs, vous interviendrez dans le cadre de projets de migrations des réseaux télécoms vers les réseaux à fibre…"
"Ingénieur Programmation, Fiabilité et Sécurité des systèmes embarqués F/H",Bruyères-le-Châtel (91),COMMISSARIAT A L' ENERGIE ATOMIQUE ET AUX ENERGIES...,None,Le service conçoit et développe des systèmes électroniques pour des applications embarquées déployés sur de grandes installations expérimentales de physique ou…
Ingénieur conception de cartes numériques,Versailles (78),Sept Lieues,52000,Société française de 200 collaborateurs appartenant à un grand groupe qui développe des solutions et des matériels contribuant à la sécurisation des réseaux…
Développement Python-3 H/F,Clamart (92),Sogetek,None,SOGETEK Informatique développe son savoir-faire dans l’informatique industrielle et technique.
Ingénieur électronique analogique confirmé et numérique (notamment FPGA) [CDI ou freelance],Aix-en-Provence (13),CELAD,None,Nous poursuivons notre développement dans le Sud-Est et recrutons un(e) ingénieur expert en électronique analogique disposant également de très bonnes…
Ingénieur Electronique numérique (F/H) -- 102020/PST/KQN,Toulouse (31),Serma Ingenierie,None,"Dans le cadre du développement de nos activités, nous recrutons un(e) Ingénieur Électronique Numérique (H/F).."
Ingénieur Traitement du Signal Modem F/H — 092020/PST/KQN,Toulouse (31),SERMA INGENIERIE,None,"Dans le cadre du développement de nos activités, nous recrutons un(e) Ingénieur(e) Traitement du signal Modem (F/H)."
Responsable Ingénierie Produits Radiocommunications H/F,Gennevilliers (92),Thales Group,None,"Thales propose des systèmes d’information et de communication sécurisés et interopérables pour les forces armées, les forces de sécurité et les opérateurs d…"
Expert Traitement du Signal - Ingénieur Telecom,Lyon (69),Cleeven,None,"Ingénieur Telecom, vous êtes un Expert en traitement du signal, sous la responsabilité du Directeur Technique, vous aurez à assurer :"
Ingénieur Validation Cartes & Modules,Séméac (65),ALSTOM,None,Nous créons des innovations intelligentes pour relever les défis de la mobilité d’aujourd'hui et de demain.
Formateur électronique (F/H) - CDD ou missions ponctuelles,Val-d'Oise,Fondation santé des étudiants de France,None,"Etablissement qui recrute/Lieu de travail : Centre de Rééducation Professionnelle Jacques Arnaud, 5 rue Pasteur, 95570 BOUFFEMONT."
Post doctrant Optoélectronique,Dunkerque (59),Université du Littoral Côte d'Opale (ULCO),30240,"MINISTERE DE L’EDUCATION NATIONALE,."
Ingénieur réseau et systèmes embarqués critiques (F/H),Bordeaux (33),IRT Saint Exupéry,None,Département: Ingénierie Systèmes et Modélisation.
CDI- Ingénieur(e) Design Digital M/F,Grenoble (38),STMicroelectronics,None,CDI- Ingénieur(e) Design Digital M/F.
Ingénieur software embarqué H/F,Blagnac (31),Altran,None,"Afin d'assurer le développement de logiciels nécessaires au projet, dans le respect des objectifs techniques, coûts, délais et qualité jusqu'à certification."
Ingénieur Développement Logiciel Paramètres H/F,Limours (91),Thales Group,None,"L’activité Systèmes terrestres et aériens conçoit des systèmes, des équipements, des capteurs et des services pour le contrôle du trafic aérien civil et…"
Ingénieur Electronique Hardware,Vélizy-Villacoublay (78),Sept Lieues,45000,Société française appartenant à un grand groupe qui développe des solutions et des matériels contribuant à la sécurisation des réseaux télécoms.
Ingénieur Systèmes logiciel (H/F),Limours (91),Thales Group,None,"L’activité Systèmes terrestres et aériens conçoit des systèmes, des équipements, des capteurs et des services pour le contrôle du trafic aérien civil et…"
Développement Python-3 H/F,Clamart (92),Sogetek,None,SOGETEK Informatique développe son savoir-faire dans l’informatique industrielle et technique.
Ingénieur.e radio logicielle F/H,Rennes (35),KEREVAL,None,"Kereval, laboratoire d'ingénierie de tests logiciels, est une référence française de la qualité logicielle."
Technicien CAO Électronique (H/F),Montpellier (34),RECRUTONS ENSEMBLE,35000,"Rattaché(e) au bureau d’études électronique & informatique, vous intégrez une équipe pluridisciplinaire.."
Apprentissage Technicien Electronique en Support Production H/F,Saint-Étienne (42),Thales Group,None,"L’activité Systèmes terrestres et aériens conçoit des systèmes, des équipements, des capteurs et des services pour le contrôle du trafic aérien civil et…"
Work-package Digital radar H/F,Limours (91),Thales Group,None,"L’activité Systèmes terrestres et aériens conçoit des systèmes, des équipements, des capteurs et des services pour le contrôle du trafic aérien civil et…"
Ingénieur VHDL Junior/Confirmé,Toulouse (31),Sept Lieues,35000,"Bureau d’études spécialisé dans la conception de systèmes critiques innovants: Aéronautique, Défense, Médical, Transport et Télécoms."
Ingénieur Test et Validation Electronique- Tours F/H,Tours (37),MCA GROUPE,None,"Au sein du département ferroviaire, vous intégrez une équipe projet intervenant en test et validation."
INGÉNIEUR ELECTRONIQUE HARDWARE (H/F) - TOULOUSE - REF AF,Toulouse (31),Fortil,35000,Dans le cadre d’un nouveau programme de carte électronique embarquée satellite vous intégrerez une équipe d’ingénieur électroniciens déjà constituée.
Ingénieur(e) conception FPGA/ASIC expérimenté(e) H/F H/F,Toulouse (31),Expleo,None,"Expleo propose une offre unique de services intégrés d'ingénierie, qualité et conseil stratégique pour la transformation digitale."
Ingenieur Developpement Systeme (H/F),Saint-Paul-lès-Durance (13),Adecco France,None,"Vous développerez des processus sous Labview et langage C, et devrez l'intégrer dans des cartes NI (acquisition et contrôle)."
Ingénieur électronique HW F/H,Lyon 1er (69),Talents Handicap,None,Description du poste et missions.
Ingénieur Traitement du Signal F/H,Nice (06),TITANE,None,"Vous participerez à la spécification d'algorithmes de traitement de signaux de télécommunication (détection, identification, goniométrie, démodulation, décodage…"
Sales Manager France (m/f/d),France,Photonfocus AG,None,Photonfocus AG is a renowned high-tech company based in Switzerland.
Ingénieur.e Responsable Sous-traitance ASIC/FPGA (WPM) H/F,Toulouse (31),Thales Group,None,"Acteur spatial mondialement reconnu dans les domaines des télécommunications, de la navigation, de l’observation de la terre, de l’exploration et de la…"
"Doctorant / Ingénieur Etudes et Développement C++, NS3",France,Ingima,None,Vous interviendrez sur un projet de conception et simulation de protocoles réseaux IPV6 sur les médias Radiofréquences et Courants porteurs.
Développement Python-3 H/F,Clamart (92),Sogetek,None,SOGETEK Informatique développe son savoir-faire dans l’informatique industrielle et technique.
Digital HW Verification Engineer,Caen (14),NXP Semiconductors,None,"(NASDAQ: NXPI) enables secure connections and infrastructure for a smarter world, advancing solutions that make lives easier, better, and safer."
Ingénieur informatique industrielle / robotique F/H,Grenoble (38),GROUPE CENTUM ADETEL,None,"Depuis plus de 25 ans, CENTUM ADENEO apporte conseil et expertise à ses clients dans le domaine de l’électronique embarqué."
Apprenti(e) chargé(e) de l'outillage de simulation des modèles d'architecture systèmes. H/F,Issoudun (36),Safran,None,"Safran est un groupe international de haute technologie opérant dans les domaines de l'aéronautique (propulsion, équipements et intérieurs), de l'espace et de…"
Ingénieur système en électronique de puissance F/H,Écully (69),GROUPE CENTUM ADETEL,None,"Depuis plus de 25 ans, CENTUM ADENEO apporte conseil et expertise à ses clients dans le domaine de l’électronique embarqué."
Ingénieur Electronique de Puissance F/H,Toulouse (31),GROUPE CENTUM ADETEL,None,"Depuis plus de 25 ans, CENTUM ADENEO apporte conseil et expertise à ses clients dans le domaine de l’électronique embarqué."
Ingénieur développement logiciel Embarqué H/F,Cholet (49),AKKA TECHNOLOGIES,None,"AKKA Groupe d’ingénierie et de conseil en technologies de plus de 21 000 concepteurs, acteurs et penseurs aux avant-postes du monde digital et connecté, est un…"
CONCEPTEUR ELECTRONIQUE CONFIRME (ABL8869) F/H,Villeneuve-Loubet (06),STUDIEL PARTICIPATIONS,None,"Vous rejoindrez notre équipe interne Etudes et Développement et serez impliqué dans nos projets électroniques : réponse appels d’offre, conception, validation,…"
Expert Logiciel Embarqué H/F,Aix-en-Provence (13),Atos,None,Atos est un leader international de la transformation digitale avec 110 000 collaborateurs dans 73 pays et un chiffre d’affaires annuel de 12 milliards d’euros.
Ingénieur Génie Électrique H/F,Saint-Quentin-Fallavier (38),ACASS,50000,Acass recrute pour un poste en CDI un(e) Ingénieur Génie Électrique H/F.
[STAGE] Traitement vidéo embarqué FPGA - Toulouse,Toulouse (31),LGM Group,None,LGM Ingénierie est une entreprise innovante dans le domaine de l’électronique embarquée et des moyens d’essai.
[STAGE] Développement d'un simulateur de capteur en FPGA pour train autonome - Toulouse,Toulouse (31),LGM Group,None,LGM Ingénierie est une entreprise innovante dans le domaine de l’électronique embarquée et des moyens d’essai.
[STAGE] Développement de briques VHDL sur FPGA H/F - Toulouse,Toulouse (31),LGM Group,None,"Dans le cadre de notre programme de R&T et d’innovation dans l’électronique spatiale, vous développerez des modules VHDL sur une nouvelle famille de FPGA…"
Ingénieur Développement FPGA,Toulouse (31),Sept Lieues,40000,Entreprise pionnière dans le développement et l'intégration d'architecture FPGA à destination des secteurs du spatial et de la défense.
Ingénieur d'Application Système Embarqué,Sèvres (92),Sept Lieues,40000,Entreprise pionnière dans le développement et l'intégration d'architecture FPGA à destination des secteurs du spatial et de la défense.
Développeur DevOps F/H,Clamart (92),SOGETEK INFORMATIQUE,35000,Depuis plus de 33 ans SOGETEK Informatique développe son savoir-faire dans l’informatique industrielle et technique.
Ingénieur Spécialiste RF (H/F),Cholet (49),Thales Group,None,"Thales propose des systèmes d’information et de communication sécurisés et interopérables pour les forces armées, les forces de sécurité et les opérateurs d…"
Ingénieur Electronique H/F,Nantes (44),AKKA TECHNOLOGIES,None,"Nous recherchons un Ingénieur Electronique (F/H) pour nous rejoindre et intégrer un projet à la pointe de l’innovation en milieu industriel, à Nantes (44)."
Silicon validation engineer,Caen (14),SCALINX,None,Job Title Silicon validation engineer.
Ingénieur Expérimenté en traitement du signal et Algorithme H/F,Toulouse (31),Expleo,None,"Expleo propose une offre unique de services intégrés d'ingénierie, qualité et conseil stratégique pour la transformation digitale."
Ingénieur électronique numérique F/H,Nantes (44),ELEPHANT TECHNOLOGIES,None,Toi le nantais ou le futur nantais.
Automotive Software Engineer,France,MRL Consulting Group,None,Avez-vous déjà imaginé quelles pourraient être les prochaines innovations pour nos véhicules autonomes ?
CHEF DE PROJET ELECTRONIQUE SYSTEME EMBARQUE/IoT POUR INSTRUMENTS DE BIODETECTION (H/F) CDI,France,BforCure,None,Date de début de contrat : dès que possible.
Techniciens en électronique,Évry (91),REFLEX CES,19440,A la recherche d’un nouveau challenge ?
Ingénieur(e) Conception FPGA Confirmé(e) H/F,Toulouse (31),LGM Group,None,"LGM Ingénierie, filiale du Groupe LGM (1 400 collaborateurs), est une société spécialisée dans l’étude, la conception, le développement, la qualification et la…"
[STAGE] Développement d'un démonstrateur : Outil de monitoring et déploiement - Toulouse,Toulouse (31),LGM Group,None,"Dans le cadre du passage vers l’industrie 4.0 et de la digitalisation croissante des bancs de tests, LGM Ingénierie souhaite développer un outil de monitoring…"
[STAGE] Développement d'un démonstrateur : Outil de monitoring et déploiement - Toulouse,Toulouse (31),LGM Group,None,"Dans le cadre du passage vers l’industrie 4.0 et de la digitalisation croissante des bancs de tests, LGM Ingénierie souhaite développer un outil de monitoring…"
Responsable Technique Electronique F/H,Toulouse (31),ECA Group,45000,Vous souhaitez relever de nouveaux challenges et rejoindre un Groupe dynamique et passionné par les technologies de pointe et l’innovation ?
Ingénieur FPGA F/H,Toulouse (31),GROUPE CENTUM ADETEL,None,"Depuis plus de 25 ans, CENTUM ADENEO apporte conseil et expertise à ses clients dans le domaine de l’électronique embarqué."
Responsable Technique Produit / PDA – Produits Identification IFF (F/H),Laval (53),Thales Group,None,"Thales propose des systèmes d’information et de communication sécurisés et interopérables pour les forces armées, les forces de sécurité et les opérateurs d…"
Ingénieur Conception FPGA Expérimenté – Grenoble F/H,Grenoble (38),SERMA INGENIERIE,None,"Dans le cadre du développement de nos activités, nous recrutons un(e) Ingénieur Conception FPGA expérimenté (F/H)."
Ingénieur électronique numérique F/H – 102020/PSR/SOZ,Grenoble (38),SERMA INGENIERIE,None,Nous recherchons à renforcer nos équipes en intégrant un Ingénieur en électronique numérique F/H.
Ingénieur développement FPGA – Région Toulousaine.SLP (F/H),Toulouse (31),SERMA INGENIERIE,None,Nous recherchons à renforcer nos équipes en intégrant un(e) Ingénieur développement FPGA (F/H).
Architecte SW/TNS/Systèmes Numériques F/H,Toulouse (31),ECA Group,45000,Vous souhaitez relever de nouveaux challenges et rejoindre un Groupe dynamique et passionné par les technologies de pointe et l’innovation ?
Ingénieur R&D C++,Paris (75),Sept Lieues,None,PME jeune et dynamique en forte croissance sur les marchés français et international.
Ingénieur Electronique,Lyon 3e (69),Sept Lieues,45000,"Plus de 50 ans d'existences, société leader sur son marché."
Ingénieur.e Conception détaillée ASIC – H/F,Toulouse (31),Thales Group,None,"Acteur spatial mondialement reconnu dans les domaines des télécommunications, de la navigation, de l’observation de la terre, de l’exploration et de la…"
[STAGE] Traitement vidéo embarqué FPGA - Toulouse,Toulouse (31),LGM Group,None,LGM Ingénierie est une entreprise innovante dans le domaine de l’électronique embarquée et des moyens d’essai.
[STAGE] Développement d'un simulateur de capteur en FPGA pour train autonome - Toulouse,Toulouse (31),LGM Group,None,LGM Ingénierie est une entreprise innovante dans le domaine de l’électronique embarquée et des moyens d’essai.
[STAGE] Développement de briques VHDL sur FPGA H/F - Toulouse,Toulouse (31),LGM Group,None,"Dans le cadre de notre programme de R&T et d’innovation dans l’électronique spatiale, vous développerez des modules VHDL sur une nouvelle famille de FPGA…"
Techniciens en électronique,Évry (91),REFLEX CES,19440,A la recherche d’un nouveau challenge ?
Ingénieur(e) Conception FPGA Confirmé(e) H/F,Toulouse (31),LGM Group,None,"LGM Ingénierie, filiale du Groupe LGM (1 400 collaborateurs), est une société spécialisée dans l’étude, la conception, le développement, la qualification et la…"
CDD - Ingénieur concepteur développeur intégrateur de logiciels H/F,Saint-Paul-lès-Durance (13),CEA - Commissariat à l'Energie Atomique,None,"La Tomographie d'Impédance Electrique (TIE), technologie proche de l'IRM et du scanner, permet de reconstruire la distribution de la conductivité électrique…"
Manager/Lead Technique Logiciel Embarqué/Microélectronique,Sèvres (92),Sept Lieues,None,Entreprise pionnière dans le développement et l'intégration d'architecture FPGA à destination des secteurs du spatial et de la défense.
Ingénieur Design et Back-End ASIC F/H,Rennes (35),SECURE-IC SAS,None,"En tant qu'Ingénieur Design et Back-End ASIC (H/F), vous participerez au développement du portefeuille d’IP cores de Secure-IC en assurant les différentes…"
Technicien intégrateur en production électronique et mécanique F/H,Pierrelatte (26),SURVEY COPTER,None,Vous serez responsable des activités principales suivantes:
Développement Python-3 H/F,Clamart (92),Sogetek,None,SOGETEK Informatique développe son savoir-faire dans l’informatique industrielle et technique.
Ingénieur.e Validation Fonctions Télécoms (H/F),Toulouse (31),Thales Group,None,"Acteur spatial mondialement reconnu dans les domaines des télécommunications, de la navigation, de l’observation de la terre, de l’exploration et de la…"
Architecte produits & systèmes pour applications FTI (Flight Test Instrumentation) H/F,Les Ulis (91),Safran,None,"Safran est un groupe international de haute technologie opérant dans les domaines de la propulsion et des équipements aéronautiques, de l'espace et de la…"
INGENIEUR DEVELOPPEMENT LOGICIEL EMBARQUE TEMPS REEL F/H | CDI H/F,Limeil-Brévannes (94),SODERN,None,"Filiale d’AIRBUS SAFRAN LAUNCHERS, SODERN compte 350 personnes dont plus de la moitié d'Ingénieurs et Cadres."
Architecte Hardware électronique numérique F/H,Valence (26),SERMA INGENIERIE,None,"Dans le cadre de notre développement, nous recrutons un(e) Architecte Hardware électronique numérique (F/H)."
Ingénieur Concepteur HDL/FPGA - H/F,Marseille (13),omniciel,None,"Omniciel, cabinet de recrutement spécialisé en It/digital, recherche un Ingénieur Concepteur HDL/FPGA - H/F pour."
INGENIEUR LOGICIEL EMBARQUE ET SYSTEMES INDUSTRIELS (H/F),Romans-sur-Isère (26),Vocation Recrutement,33000,"VOCATION RECRUTEMENT recherche pour son client du bassin de Romans sur Isère (26), un Ingénieur Logiciel embarqué et systèmes industriels (H/F) en CDI."
Un(e) Développeur VHDL H/F a proximité d'Eyguieres,Eyguières (13),"ACASS, agence de recrutement",35000,"ACASS Istres, Agence de recrutement, recrute pour son client un(e) Developpeur VHDL H/F dans le cadre d’une embauche en CDI."
Ingénieur(e) Vérification Emulation ASIC /FPGoC (H/F),Toulouse (31),Derichebourg Aeronautics Recruitment,None,"Nous recherchons pour notre client, un groupe international opérant dans les domaines de l'aérospatial un Ingénieur Vérification Emulation ASIC/FPGA/SoC H/F."
Ingénieur Cybersécurité et développement logiciel H/F,Limours (91),Thales Group,None,"L’activité Systèmes terrestres et aériens conçoit des systèmes, des équipements, des capteurs et des services pour le contrôle du trafic aérien civil et…"
Architecte électronique F/H,Lyon 9e (69),GROUPE CENTUM ADETEL,None,"Depuis plus de 25 ans, CENTUM ADENEO apporte conseil et expertise à ses clients dans le domaine de l’électronique embarqué."
Responsable Technique Calculateurs Satellite - H/F,Toulouse (31),Thales Group,None,"Acteur spatial mondialement reconnu dans les domaines des télécommunications, de la navigation, de l’observation de la terre, de l’exploration et de la…"
Ingénieur R&D – Electronique embarquée - Capteur d’images,Perpignan (66),EXTREM VISION,None,"Extrem Vision est une PME sur Perpignan (66) spécialisée dans l’étude, la conception et la fabrication de matériels dédiés aux milieux à fortes contraintes …"
Ingénieur électronique FPGA – Toulouse – MDI,Toulouse (31),SERMA INGENIERIE,None,Nous recherchons à renforcer nos équipes en intégrant un(e) Ingénieur en développement FPGA.
Ingénieur Système Temps Réel H/F,Saint-Paul-lès-Durance (13),Assystem,None,"Depuis 50 ans, nous sommes animés par la conviction que les ingénieurs, par leur audace, leur expertise et leur capacité à faire bouger les lignes sont les…"
Développement Python-3 H/F,Clamart (92),Sogetek,None,SOGETEK Informatique développe son savoir-faire dans l’informatique industrielle et technique.
Ingénieur traitement du signal numérique,Toulouse (31),Silkhom,None,"Rattaché(e) au Responsable du département Ingénierie Numérique et intégré(e) à une équipe de 6 personnes, votre rôle est de développer et d'améliorer les…"
Ingénieur développement FPGA (F/H) – Région Toulousaine. Réf: SLP2003,Toulouse (31),SERMA INGENIERIE,None,Nous recherchons à renforcer nos équipes en intégrant un(e) Ingénieur développement FPGA (F/H).
Technicien intégrateur en production électronique et mécanique H/F,Pierrelatte (26),SURVEY COPTER SARL,None,SURVEY Copter est située à Pierrelatte (Drôme).
INGÉNIEUR CONFIRMÉ CONCEPTION ELECTRONIQUE (H/F) - TOULOUSE - REF SM,Toulouse (31),Fortil,None,En tant qu'ingénieur confirmé conception électronique vous avez pour missions :
Ingénieur Etudes & Développement Calculateur Hardware H/F,Sophia Antipolis (06),Thales Group,None,"L’activité Systèmes de missions de défense fournit des équipements, des solutions et des services liés aux systèmes de combat électroniques, de surveillance et…"
INGÉNIEUR DÉVELOPPEMENT CONTRÔLE-COMMANDE H/F,Saint-Paul-lès-Durance (13),Proman interim,15,Votre agence PROMAN SAINT PAUL LEZ DURANCE recherche pour l'un de ses clients un ingénieur développement contrôle-commande H/F.
Architecte Traitement Signal Modem (H/F),Toulouse (31),Thales Group,None,"Acteur spatial mondialement reconnu dans les domaines des télécommunications, de la navigation, de l’observation de la terre, de l’exploration et de la…"
Expert(e) Électronique (F/H) – Région Toulousaine. Réf SLP2003,Toulouse (31),SERMA INGENIERIE,None,"Dans le cadre du développement de nos activités, nous recrutons un(e) Expert(e) Électronique (F/H)."
Chef de Projets Systèmes Embarqués (H/F),Aix-en-Provence (13),IT link,None,IT Link Recherche pour un de ses clients basé à Aix-en-Provence un Chef de Projets (H/F).
Ingénieur Hardware H/F,Île-de-France,QUIBLIER-conseil,None,"Nous recherchons pour notre client, acteur majeur de dimension mondiale dans les secteurs de l’espace, le transport terrestre, l‘identité et la sécurité…"
[STAGE] Développement d'un démonstrateur : Outil de monitoring et déploiement - Toulouse,Toulouse (31),LGM Group,None,"Dans le cadre du passage vers l’industrie 4.0 et de la digitalisation croissante des bancs de tests, LGM Ingénierie souhaite développer un outil de monitoring…"
INGENIEUR ELECTRONIQUE ALTIUM DESIGNER (H/F) – BORDEAUX – REF CB,Bordeaux (33),Fortil,34000,"Rejoindre FORTIL Bordeaux, c’est intégrer une équipe composée de business managers et de recruteurs."
Ref RX S CHEF de PROJETS EXPERIMENTE ELECTRONIQUE EMBARQUE F/H,Lisses (91),Cabinet CIMEM,None,"Familier de la R & D en matières de cartes ou de systèmes électroniques , vous prendrez en charge la conduite intégrale de plusieurs projets que vous encadrerez…"
Ingénieur.e Electronique confirmé.e F/H,Montpellier (34),ECA Robotics,None,Les équipes composées de techniciens et dingénieurs garantissent une veille technologique assurant la pérennité et la qualité des produits.
Ingénieur Développement ASIC,Gennevilliers (92),Sept Lieues,40000,"Leader mondial des technologies de sûreté et de sécurité pour les marchés de l’Aérospatial, du Transport, de la Défense et de la Sécurité, ce client bénéficie d…"
Ingénieur conception et développement électronique H/F,Grenoble (38),Hays,49000,"Notre client, société spécialisée dans la recherche et développement en médical, recherche un Ingénieur conception et développement de cartes électroniques…"
IC DIGITAL BACKEND ENGINEER F/M,Sèvres (92),NanoXplore,None,NanoXplore is a pioneer in design and development of space-grade FPGA and e-FPGA located in Paris and.
RTL Design Engineer,Marseille (13),IC Resources,None,"Senior RTL Designer – Beautiful location of Aix-en-Provence, France – Fab Technology!!"
Docteur Systèmes Embarqués F/H,Toulouse (31),SCALIAN,None,Vous êtes Docteur en Systèmes Embarqués et à la recherche d’un poste ?
Ingénieur validation logicielle F/H,Lyon 9e (69),GROUPE CENTUM ADETEL,None,"Depuis plus de 25 ans, CENTUM ADENEO apporte conseil et expertise à ses clients dans le domaine de l’électronique embarqué."
