Title,Location,Company,Salary_per_year,Summary
[STAGE] Traitement vidéo embarqué FPGA - Toulouse,Toulouse (31),LGM Group,None,LGM Ingénierie est une entreprise innovante dans le domaine de l’électronique embarquée et des moyens d’essai.
[STAGE] Développement d'un simulateur de capteur en FPGA pour train autonome - Toulouse,Toulouse (31),LGM Group,None,LGM Ingénierie est une entreprise innovante dans le domaine de l’électronique embarquée et des moyens d’essai.
Concepteur FPGA H/F,Le Plessis-Robinson (92),MBDA,None,"MBDA, au cœur de notre défense… Rejoignez notre groupe, leader européen dans la conception, la fabrication et la commercialisation de missiles et de systèmes d…"
Ingénieur design électronique VHDL FPGA pour équipements spatiaux (h/f),Paris (75),Airbus,None,Airbus Defence and Space SAS.
Ingénieur développement FPGA F/H - CLZ,Guyancourt (78),Groupe SERMA,None,Ingénieur développement fpga f/h - clz ou similaire: 3 ans (Souhaité).
Stage optimisation implémentation FPGA,Ivry-sur-Seine (94),Sonoscanner,None,"Rejoignez notre équipe R&D, un métier passionnant et à fort potentiel !"
Ingénieur FPGA H/F – Paris SGO,Paris (75),SERMA INGENIERIE,None,Poste d’ingénieurs FPGA sur des projets Défense et Industrie.
"Stage FPGA, interface vidéo numérique H/F",Les Ulis (91),Safran,None,"Safran est un groupe international de haute technologie opérant dans les domaines de la propulsion et des équipements aéronautiques, de l'espace et de la…"
Ingénieur Essais Simulation HWIL H/F,Le Plessis-Robinson (92),MBDA,None,"MBDA, au cœur de notre défense… Rejoignez notre groupe, leader européen dans la conception, la fabrication et la commercialisation de missiles et de systèmes d…"
"Stage FPGA, évaluation High Level Synthesis H/F",Les Ulis (91),Safran,None,"Safran est un groupe international de haute technologie opérant dans les domaines de la propulsion et des équipements aéronautiques, de l'espace et de la…"
FPGA Intern,Paris (75),NovaSparks,1000,NovaSparks est le leader mondial du traitement de données boursières à base de FPGA.
Stage Deep Learning sur FPGA H/F,Éragny (95),Safran,None,"Safran est un groupe international de haute technologie opérant dans les domaines de l'aéronautique (propulsion, équipements et intérieurs), de l'espace et de…"
H/F Doctorant en Microelectronique: Implémentations des réseaux de neurones oscillatoire par le FPGA pour l'intelligence artificielle,Montpellier (34),CNRS,25620,Assurez-vous que votre profil candidat soit correctement renseigné avant de postuler.
Stage Génération d'architecture FPGA H/F,Éragny (95),Safran,None,"Safran est un groupe international de haute technologie opérant dans les domaines de l'aéronautique (propulsion, équipements et intérieurs), de l'espace et de…"
Ingénieur FPGA (H/F),Bordeaux (33),Abylsen Sigma,30000,"_Un groupe de conseil en ingénierie fondé en 2005, présent en France et à l’international (Belgique, Luxembourg et Suisse)."
Stage Deep Learning sur FPGA H/F,Éragny (95),Safran,None,"Safran est un groupe international de haute technologie opérant dans les domaines de l'aéronautique (propulsion, équipements et intérieurs), de l'espace et de…"
H/F Doctorant en Microelectronique: Implémentations des réseaux de neurones oscillatoire par le FPGA pour l'intelligence artificielle,Montpellier (34),CNRS,25620,Assurez-vous que votre profil candidat soit correctement renseigné avant de postuler.
Stage Génération d'architecture FPGA H/F,Éragny (95),Safran,None,"Safran est un groupe international de haute technologie opérant dans les domaines de l'aéronautique (propulsion, équipements et intérieurs), de l'espace et de…"
Ingénieur FPGA (H/F),Bordeaux (33),Abylsen Sigma,30000,"_Un groupe de conseil en ingénierie fondé en 2005, présent en France et à l’international (Belgique, Luxembourg et Suisse)."
Stage Bac+5 - Ingénieur Développement FPGA et Filtrage Audio F/H,Cholet (49),Thales Group,None,"Thales propose des systèmes d’information et de communication sécurisés et interopérables pour les forces armées, les forces de sécurité et les opérateurs d…"
STAGE 2021 – Mise en œuvre d’un FPGA spatial de nouvelle génération (h/f),Paris (75),Airbus,None,Airbus Defence and Space SAS.
INGENIEUR HARDWARE FPGA H/F,Élancourt (78),MILESYS,35000,Ingenieur hardware fpga ou similaire: 5 ans (Requis).
INGENIEUR EN SECURITE DE L’INFORMATION JUNIOR (H/F),Paris (75),Airbus,None,"Airbus is a global leader in aeronautics, space and related services."
INGÉNIEUR HARDWARE ELECTRONIQUE #FPGA @EVRY,Évry (91),My Tech Agency,40000,Ingénieur hardware electronique #fpga @evry ou similaire: 3 ans (Requis).
Ingénieur FPGA F/H,Fontenay-aux-Roses (92),Groupe AMETRA,None,Pour renforcer notre BE spécialisé en intégration système et développer notre pôle FPGA.
Ingénieur FPGA H/F,Palaiseau (91),GROUPE CENTUM ADETEL,None,"Depuis plus de 25 ans, CENTUM ADENEO apporte conseil et expertise à ses clients dans le domaine de l’électronique embarqué."
Stage Bac+ 5 - Ingénieur Développement FPGA sur cible Zynq MPSoC F/H,Cholet (49),Thales Group,None,"Thales propose des systèmes d’information et de communication sécurisés et interopérables pour les forces armées, les forces de sécurité et les opérateurs d…"
Ingénieur(e) en électronique/systèmes embarqués - microprocesseur (langage C) H/F,Montigny-le-Bretonneux (78),Expleo,None,"Expleo propose une offre unique de services intégrés d'ingénierie, qualité et conseil stratégique pour la transformation digitale."
Ingénieur conception FPGA – CLZ F/H,Guyancourt (78),SERMA INGENIERIE,None,"Dans le cadre de notre développement, nous recherchons pour l’un de nos clients dans le secteur du spatial un ingénieur conception FPGA f/H."
INGENIEUR EN SECURITE DE L’INFORMATION JUNIOR (H/F),Les Mureaux (78),APSYS Airbus,None,Date de début : 29-09-2020.
INGENIEUR EN SECURITE DE L’INFORMATION JUNIOR (H/F),Les Mureaux (78),APSYS Airbus,None,Date de début : 29-09-2020.
Ingénieur Traitement de Signal - FPGA (H/F),Toulouse (31),Solead RH,40000,"Solead RH est un cabinet de chasse de tête & de recrutement Toulousain, issu du terrain depuis plus d’une dizaine d’années, nous relevons chaque challenge en…"
Stage Bac+ 5 – Ingénieur développement Plateforme FPGA F/H,Cholet (49),Thales Group,None,"Thales propose des systèmes d’information et de communication sécurisés et interopérables pour les forces armées, les forces de sécurité et les opérateurs d…"
Ingénieur Développement FPGA,Saint-Jean-Bonnefonds (42),Mu-Test,34800,Ingénieur développement fpga ou similaire: 1 an (Souhaité).
"Chef de Projet R&D FPGA H/F - Habilitation secret défense - Leader français, fabricant de cartes électroniques complexes FPGA",Lisses (91),Michael Page,60000,"Au titre de Chef de Projets R&D, vous êtes le garant des missions suivantes :"
Stage Bac+ 5 – Ingénieur développement FPGA F/H,Cholet (49),Thales Group,None,"Thales propose des systèmes d’information et de communication sécurisés et interopérables pour les forces armées, les forces de sécurité et les opérateurs d…"
Ingénieur d’Application/Support Technique (FAE) F/H,Chatou (78),MACNICA ATD EUROPE,None,Vous aurez en charge le support technique auprès de nos clients et de l’équipe commerciale pour développer l’intégration des produits de nos partenaires.
Stage Implémentation & validation IP High Speed Ethernet Subsystem sur cible FPGA H/F,Les Ulis (91),Safran,None,"Safran est un groupe international de haute technologie opérant dans les domaines de la propulsion et des équipements aéronautiques, de l'espace et de la…"
Stage 2021- Ingénieur Electronique/Informatique pour le spatial (h/f),Paris (75),Airbus,None,Airbus Defence and Space SAS.
STAGE 2021 – Mise en œuvre d’un composant crypto sur équipement spatial (h/f),Paris (75),Airbus,None,Airbus Defence and Space SAS.
Responsable technique plateforme de test H/F,Le Plessis-Robinson (92),MBDA,None,"MBDA, au cœur de notre défense… Rejoignez notre groupe, leader européen dans la conception, la fabrication et la commercialisation de missiles et de systèmes d…"
Ingénieur électrotechnique/ électronique de puissance,France,Jeumont Electric,None,"Altawest est un groupe entrepreneur spécialiste des technologies de l’efficacité énergétique et environnementales, exerçant ses activités à destination des…"
ARCHITECTE FPGA ASIC F/H,Nice (06),Progressive,None,"Leader sur un marché spécifique,."
Stage - Implémentation d'un détecteur d'erreur de phase optimisé pour les faibles SNR H/F,Les Ulis (91),Safran,None,"Safran est un groupe international de haute technologie opérant dans les domaines de la propulsion et des équipements aéronautiques, de l'espace et de la…"
Ingénieur(e) en électronique/systèmes embarqués - FPGA - CPL Intelligent H/F,Montigny-le-Bretonneux (78),Expleo,None,"Expleo propose une offre unique de services intégrés d'ingénierie, qualité et conseil stratégique pour la transformation digitale."
Ingénieur(e) Développement Logiciel - Toulouse,Toulouse (31),LGM Group,None,"Maintenant que tu as parcouru notre site et bien compris les activités du groupe, voici un focus sur l’entité qui te concerne !"
"Urgent, CDD 4 mois ingénieur électronique ou technicien expérimenté",Saint-Martin-d'Hères (38),ID Partner,27600,"ID partner est une TPE Grenobloise en pleine évolution dans le monde de l’électronique, électrotechnique, automatique, appliquée à des situations concrètes."
Stage Bac+ 5 – Ingénieur développement FPGA F/H,Cholet (49),Thales Group,None,"Thales propose des systèmes d’information et de communication sécurisés et interopérables pour les forces armées, les forces de sécurité et les opérateurs d…"
Ingénieur d’Application/Support Technique (FAE) F/H,Chatou (78),MACNICA ATD EUROPE,None,Vous aurez en charge le support technique auprès de nos clients et de l’équipe commerciale pour développer l’intégration des produits de nos partenaires.
Stage Implémentation & validation IP High Speed Ethernet Subsystem sur cible FPGA H/F,Les Ulis (91),Safran,None,"Safran est un groupe international de haute technologie opérant dans les domaines de la propulsion et des équipements aéronautiques, de l'espace et de la…"
Stage 2021- Ingénieur Electronique/Informatique pour le spatial (h/f),Paris (75),Airbus,None,Airbus Defence and Space SAS.
STAGE 2021 – Mise en œuvre d’un composant crypto sur équipement spatial (h/f),Paris (75),Airbus,None,Airbus Defence and Space SAS.
Responsable technique plateforme de test H/F,Le Plessis-Robinson (92),MBDA,None,"MBDA, au cœur de notre défense… Rejoignez notre groupe, leader européen dans la conception, la fabrication et la commercialisation de missiles et de systèmes d…"
Ingénieur électrotechnique/ électronique de puissance,France,Jeumont Electric,None,"Altawest est un groupe entrepreneur spécialiste des technologies de l’efficacité énergétique et environnementales, exerçant ses activités à destination des…"
ARCHITECTE FPGA ASIC F/H,Nice (06),Progressive,None,"Leader sur un marché spécifique,."
Stage - Implémentation d'un détecteur d'erreur de phase optimisé pour les faibles SNR H/F,Les Ulis (91),Safran,None,"Safran est un groupe international de haute technologie opérant dans les domaines de la propulsion et des équipements aéronautiques, de l'espace et de la…"
Ingénieur(e) en électronique/systèmes embarqués - FPGA - CPL Intelligent H/F,Montigny-le-Bretonneux (78),Expleo,None,"Expleo propose une offre unique de services intégrés d'ingénierie, qualité et conseil stratégique pour la transformation digitale."
[STAGE] Traitement vidéo embarqué FPGA - Toulouse,Toulouse (31),LGM Group,None,LGM Ingénierie est une entreprise innovante dans le domaine de l’électronique embarquée et des moyens d’essai.
[STAGE] Développement d'un simulateur de capteur en FPGA pour train autonome - Toulouse,Toulouse (31),LGM Group,None,LGM Ingénierie est une entreprise innovante dans le domaine de l’électronique embarquée et des moyens d’essai.
[STAGE] Développement de briques VHDL sur FPGA H/F - Toulouse,Toulouse (31),LGM Group,None,"Dans le cadre de notre programme de R&T et d’innovation dans l’électronique spatiale, vous développerez des modules VHDL sur une nouvelle famille de FPGA…"
Techniciens en électronique,Évry (91),REFLEX CES,19440,A la recherche d’un nouveau challenge ?
Ingénieur développement FPGA (26) F/H – 102020/PSR/SOZ,Valence (26),SERMA INGENIERIE,None,"Dans le cadre du développement de notre activité, nous recherchons à renforcer nos équipes en intégrant un Ingénieur développement FPGA F/H."
Responsable de Projet FPGA -- 102020/PST/KQN,Toulouse (31),Serma Ingenierie,48000,Responsable de projet fpga -- 102020/pst/kqn ou similaire: 10 ans (Souhaité).
Ingénieur Logiciels embarqués F/H,Boulogne-Billancourt (92),ADENTIS,None,"Intégré(e) au sein d'une équipe projet, vous intervenez sur les différentes phases du cycle de développement, de l'analyse fonctionnelle aux phases de…"
Ingénieur logiciel embarqué H/F,Élancourt (78),ABMI,None,"Depuis 35 ans, ABMI s’engage pour la conception de produits de qualité et pour l’optimisation de la performance des processus et des installations industrielles…"
Ingénieur FPGA - 092020/PST/SCH,Toulouse (31),SERMA INGENIERIE,None,Ingénieur fpga ou similaire: 2 ans (Souhaité).
Ingénieur développement FPGA H/F,Vélizy-Villacoublay (78),Altran,None,"La division Aeronautics, Spatial & Defence - Railway (ASD-R) de la région Ile-de-France intervient dans quatre grands domaines : l’aéronautique, le spatial, la…"
Alternant en Electronique H/F,Rosny-sous-Bois (93),Conduent,None,Conduent delivers mission-critical services and solutions on behalf of businesses and governments – creating exceptional outcomes for its clients and the…
INGENIEUR DEVELOPPEMENT FPGA,Toulouse (31),Médiane Ingénierie,None,"Au sein du service électronique numérique, vous êtes chargé du développement des FGPA."
Ingénieur développement FPGA – 092020/PST/SCH,Toulouse (31),SERMA INGENIERIE,None,"Dans le cadre de votre fonction, vos missions seront les suivantes :"
FPGA Design Engineer (H/F) – La Ciotat,La Ciotat (13),Genwaves,None,FPGA DESIGN ENGINEER (H/F).
Développement Python-3 H/F,Clamart (92),Sogetek,None,SOGETEK Informatique développe son savoir-faire dans l’informatique industrielle et technique.
Ingénieur architecture radiofréquence H/F,Montigny-le-Bretonneux (78),ATERMES,60000,Vous serez rattaché(e) au Chef de service Électronique.
Ingénieur Développement Spécialité Electronique,Île-de-France,NEXEYA,None,"Dans le cadre du renforcement de son activité dans les systèmes électroniques embarqués (calculateur et écrans durcis), vous intègrerez l’établissement de Massy…"
INGÉNIEUR TRAITEMENT DU SIGNAL H/F,Saint-Aubin-lès-Elbeuf (76),ARELIS,None,"ARELIS, un des fleurons industriel français, est le partenaire de référence pour concevoir et réaliser des sous-systèmes hyperfréquence duaux."
Ingénieur FPGA H/F,Toulouse (31),Expleo,None,"Expleo propose une offre unique de services intégrés d'ingénierie, qualité et conseil stratégique pour la transformation digitale."
Stage ingénieur : Développement logiciel C embarqué sur SoC (f/m),Caen (14),NXP Semiconductors,None,"(NASDAQ: NXPI) enables secure connections and infrastructure for a smarter world, advancing solutions that make lives easier, better, and safer."
Ingénieur Bureau d'Etude électronique & systèmes embarqués (H/F),La Seyne-sur-Mer (83),SNEF,None,Nous recherchons un.e Ingénieur.e B.
Casque instrumenté : capteurs piézoélectriques souples & innovants pour interface tactile. H/F,Grenoble (38),CEA - Commissariat à l'Energie Atomique,None,L’objectif du stage est de concevoir et de réaliser des cartes électroniques spécifiques à des dispositifs de capteurs flexibles piézoélectriques innovants …
Architecte Système & Electronique F/H,Fontenay-aux-Roses (92),Groupe AMETRA,None,"Au sein de notre bureau d’étude, sous la responsabilité du chef de projet, votre rôle sera de piloter et réaliser les activités systèmes et conception pour des…"
Ingénieur expérimenté FPGA. JCU,Guyancourt (78),SERMA INGENIERIE,None,"Dans le cadre d’un projet aéronautique, nous recherchons un(e) Ingénieur(e) FPGA."
Chef de Projet Electronique #FPGA @EVRY,Évry (91),My Tech Agency,45000,(nom) féminin /tɛk/ : cabinet startup en recrutement spécialisée sur les métiers de l’ingénierie industrielle qui transforme les modes de recrutement classique.
Ingénieur Logiciel C++ IA,Paris (75),Sept Lieues,None,Entreprise française d'une dizaine de personnes proposant un système innovant d'accélérateur de calculs destiné à l'Intelligence Artificielle.
Engineering Internship,Sophia Antipolis (06),Arm,None,"We are an Equal Opportunity Employer and do not discriminate against any employee or applicant for employment because of race, color, sex, age, national origin,…"
Expert Layout/PCB (H/F),Les Clayes-sous-Bois (78),Atos,None,Atos est un leader international de la transformation digitale avec 110 000 collaborateurs dans 73 pays et un chiffre d’affaires annuel de 12 milliards d’euros.
Stage Data Extraction & Profiling de données H/F,Les Ulis (91),Safran,None,"Safran est un groupe international de haute technologie opérant dans les domaines de la propulsion et des équipements aéronautiques, de l'espace et de la…"
Electronic Technicians,Évry (91),REFLEX CES,None,A la recherche d’un nouveau challenge ?
Stage Bac+5 - Ingénieur développement FPGA &Sécurisation réseaux IP F/H,Cholet (49),Thales Group,None,"Thales propose des systèmes d’information et de communication sécurisés et interopérables pour les forces armées, les forces de sécurité et les opérateurs d…"
Développeur FPGA H/F,Les Ulis (91),Safran,None,"Safran est un groupe international de haute technologie opérant dans les domaines de la propulsion et des équipements aéronautiques, de l'espace et de la…"
Gestionnaire de bases de données H/F,Le Plessis-Robinson (92),MBDA,None,Venez partager et développer vos compétences avec nos 3000 collaborateurs sur notre site du Plessis-Robinson !
Ingénieur Electronique F/H,Paris 8e (75),"SEPT LIEUES, NEXT MONDAYS",None,"Rattaché.e au directeur technique, au sein d'une équipe R&D de 8 personnes ."
Gestionnaire de bases de données H/F,Le Plessis-Robinson (92),MBDA,None,Venez partager et développer vos compétences avec nos 3000 collaborateurs sur notre site du Plessis-Robinson !
Ingénieur Electronique F/H,Paris 8e (75),"SEPT LIEUES, NEXT MONDAYS",None,"Rattaché.e au directeur technique, au sein d'une équipe R&D de 8 personnes ."
Ingénieur Développement logiciel Labview (RHAPO0907) F/H,Achères (78),EMC,None,"Dans le cadre de notre développement, au sein de notre Business Unit Bancs de test et sous la Responsabilité du Responsable du Bureau d'études, vous intervenez…"
Expert Electronique Layout/PCB (H/F),Les Clayes-sous-Bois (78),Atos,None,Atos est un leader international de la transformation digitale avec 110 000 collaborateurs dans 73 pays et un chiffre d’affaires annuel de 12 milliards d’euros.
ÉLECTRONICIEN FPGA (H/F),Aix-en-Provence (13),Fortil,None,Il s’agit d’un poste pour un projet complexe en électronique.
Ingénieur électronique numérique H/F,Aix-en-Provence (13),Atos,None,Atos est un leader international de la transformation digitale avec 110 000 collaborateurs dans 73 pays et un chiffre d’affaires annuel de 12 milliards d’euros.
Technicien CAO Electronique F/H,Palaiseau (91),GROUPE CENTUM ADETEL,None,"Depuis plus de 25 ans, CENTUM ADENEO apporte conseil et expertise à ses clients dans le domaine de l’électronique embarqué."
Ingénieur électronique analogique RF F/H,Palaiseau (91),GROUPE CENTUM ADETEL,None,"Depuis plus de 25 ans, CENTUM ADENEO apporte conseil et expertise à ses clients dans le domaine de l’électronique embarqué."
Ingénieur FPGA Test & Caractérisation,Saint-Cloud (92),Sept Lieues,40000,Entreprise pionnière dans le développement et l'intégration d'architecture FPGA à destination des secteurs du spatial et de la défense.
STAGE – ELECTRONIQUE NUMERIQUE FPGA F/H,Cornebarrieu (31),SERMA INGENIERIE,None,"Dans le cadre du développement de nos activités, nous cherchons aujourd’hui à renforcer nos équipes en intégrant un(e) STAGIAIRE INGENIEUR(E) FPGA (F/H)."
Développement Python-3 H/F,Clamart (92),Sogetek,None,SOGETEK Informatique développe son savoir-faire dans l’informatique industrielle et technique.
Chef de Projet FPGA -- 102020/PST/KQN,Toulouse (31),Serma Ingenierie,40000,"Le groupe SERMA* (CA de 140M€, plus de 1300 collaborateurs), dans le cadre du fort développement de sa filiale SERMA Ingénierie, recherche aujourd’hui à…"
(H/F) Electronicien - ne,Toulouse (31),CNRS,23160,Assurez-vous que votre profil candidat soit correctement renseigné avant de postuler.
C/C++ Embedded Software Developer,Paris (75),GrAI Matter Labs,None,"GrAI Matter Labs (www.graimatterlabs.ai (http://www.graimatterlabs.ai/)) is a growing fabless semiconductor company with offices in San Jose, Paris and…"
Responsable de Projet FPGA (F/H) — 102020/PST/KQN,Toulouse (31),SERMA INGENIERIE,None,"Le groupe SERMA (CA de 140M€, plus de 1300 collaborateurs), dans le cadre du fort développement de sa filiale SERMA Ingénierie, recherche aujourd’hui à…"
Ingénieur en electronique numérique/SGO,Gennevilliers (92),SERMA INGENIERIE,None,Besoin pour un projet de conception de carte pour des équipements aéronautiques militaires.
Ingénieur R&D HPC (F/H),France,Eolen France,None,AS+ est la filiale du Groupe EOLEN portant les activités liées au calcul haute performance (HPC).
Ingénieur conception FPGA expérimenté H/F,Toulouse (31),Expleo,None,"Expleo propose une offre unique de services intégrés d'ingénierie, qualité et conseil stratégique pour la transformation digitale."
Ingénieur d'études,France,Ortec,None,"Améliorer la conception d'un drone, analyser les défaillances d'une centrale inertielle, fiabiliser le calculateur d'un turboréacteur,…."
GUI SOFTWARE ENGINEER F/M,Sèvres (92),NanoXplore,None,NanoXplore is a pioneer in design and development of space-grade FPGA and e-FPGA located in Paris and.
Ingénieur Electronique,Toulouse (31),ASTEK,None,Ce que nous allons accomplir ensemble :
Ingénieur électronique H/F,Villepinte (93),EXPECTRA,40000,"EXPECTRA, *recherche pour l'un de ses clients, spécialisé dans la conception sur mesure de systèmes LED, un(e) Ingénieur électronique H/F."
Ingénieur JAVA F/H,Clamart (92),SOGETEK INFORMATIQUE,35000,Depuis plus de 33 ans SOGETEK Informatique développe son savoir-faire dans l’informatique industrielle et technique.
Chef de Projet R&D H/F - Leader de cartes électroniques FPGA,Lisses (91),Michael Page,60000,"Au titre de Chef de Projets R&D, vous êtes le garant des missions suivantes :"
Développeur C++ – Startup computer vision,Paris (75),Konekt,55000,Startup créée en 2018 qui vient de réaliser une levée de fond de plus d'un million d'euros.
Ingénieur LAYOUT Electronique numérique F/H,Vélizy-Villacoublay (78),ONESIDE TECHNOLOGIES,None,Nous recherchons un ingénieur électronique pour intervenir sur une mission d'ingénieur CAO/PCB électronique dans le domaine de l'informatique.
Ingénieur Electronique – Equipement Médical,Puteaux (92),Triskell Consulting,40000,"Dans le cadre du développement d’une nouvelle gamme de produits permettant de réaliser certaines analyses médicales, nous recrutons un Ingénieur en conception…"
Ingénieur FPGA F/H,Toulouse (31),SCALIAN,None,Vous êtes Ingénieur FPGA et vous êtes à la recherche d'un nouveau challenge ?
FPGA Digital Design Engineer,Sophia Antipolis (06),IC Resources,None,"Salary: €50,000- €80,000 with excellent benefits."
Développement Python-3 H/F,Clamart (92),SOGETEK INFORMATIQUE,30000,SOGETEK Informatique développe son savoir-faire dans l’informatique industrielle et technique.
Développement Python-3 H/F,Clamart (92),SOGETEK INFORMATIQUE,30000,SOGETEK Informatique développe son savoir-faire dans l’informatique industrielle et technique.
Développeur Contrôle Asservissement Systèmes - Secteur Militaire,Lille (59),Alphadoz,None,"Le Groupe ALPHADOZ® a vu le jour en avril 2011, suite au succès rencontré par la société d’ingénierie AQUATRIX® créée en 2008 et spécialisée dans le domaine de…"
INGÉNIEUR-CHERCHEUR EN ÉLECTRONIQUE NUMÉRIQUE (H/F),Châtillon (92),ONERA,None,"L’ONERA, acteur central de la recherche aéronautique et spatiale, emploie environ 1950 personnes."
Responsable métier FPGA & DCS DO-254 (H/F),Chatou (78),Thales Group,None,L’activité avionique rassemble 10 000 collaborateurs qui œuvrent à fournir des équipements et des systèmes de pointe pour toute la chaîne de l’aéronautique…
Developpeur logiciel embarqué,Bièvres (91),Protectic,None,Protectic recherche plusieurs Ingénieurs en dévelopement de logiciel embarqué H/F.
Ingénieur/Développeur Logiciels Embarqués H-F,Dijon (21),Oberthur Cash Protection,None,"Intégré(e) au service R&D, dans son pôle Embarqué, l'Ingénieur/Développeur logiciels embarqués (H/F) aura pour missions :"
Package Development Engineer,Nantes (44),Microchip Technology,None,Microchip Technology Inc. is a leading provider of embedded control applications.
Ingénieur électronique FPGA F/H — 102020/PST/KQN,Toulouse (31),SERMA INGENIERIE,None,Nous recherchons à renforcer nos équipes en intégrant un(e) Ingénieur électronique FPGA (F/H).
