Title,Location,Company,Salary_per_year,Summary
INGENIEUR RAMS ELECTRONIQUE F/H,Tours (37),Studiel,34000,"Dans le cadre d'un projet in situ client, vous analyserez les architectures et schémas électroniques pour évaluer les aspects fiabilité, disponibilité et…"
Stage Bac+5 - Ingénieur développement FPGA &Sécurisation réseaux IP F/H,Cholet (49),Thales Group,None,"Thales propose des systèmes d’information et de communication sécurisés et interopérables pour les forces armées, les forces de sécurité et les opérateurs d…"
STAGE – Implémentation d’un algorithme ANC sur un SOC FPGA F/H,Cornebarrieu (31),SERMA INGENIERIE,None,Sujet : Implémentation d’un algorithme ANC (Active Noise Cancelling) sur un SOC FPGA INTEL CYCLONE V.
STAGE – Implémentation d’un algorithme ANC sur un SOC FPGA F/H,Cornebarrieu (31),SERMA INGENIERIE,None,Sujet : Implémentation d’un algorithme ANC (Active Noise Cancelling) sur un SOC FPGA INTEL CYCLONE V.
Ingénieur FPGA Vidéo,Les Ulis (91),Sept Lieues,40000,"Entreprise de renommée qui conçoit et fabrique une large gamme de produits et solutions dans les domaines de la télémesure bord & sol, du traitement embarqué de…"
Ingénieur d'Application FPGA,Sèvres (92),Sept Lieues,40000,Entreprise pionnière dans le développement et l'intégration d'architecture FPGA à destination des secteurs du spatial et de la défense.
Chef de projet FPGA F/H – 102020/PSR/SOZ,Grenoble (38),SERMA INGENIERIE,None,"Dans le cadre du développement de nos activités, au sein de notre centre de service dédié au nucléaire civile, nous recrutons un Chef de Projet en FPGA F/H pour…"
ANALOG/MIXED-SIGNAL DESIGN ENGINEER F/M,Sèvres (92),NanoXplore,None,NanoXplore is a pioneer in design and development of space-grade FPGA and e-FPGA located in Paris and.
CDI- Ingénieur(e) Développement FPGA M/F,Grenoble (38),STMicroelectronics,None,CDI- Ingénieur(e) Développement FPGA M/F.
SGO Ingénieur en électronique numérique,Gennevilliers (92),Serma Technologies,None,Besoin pour un projet de conception de carte pour des équipements aéronautiques militaires.
Développement Python-3 H/F,Clamart (92),Sogetek,None,SOGETEK Informatique développe son savoir-faire dans l’informatique industrielle et technique.
Ingénieur Electronique Analogique/Numérique H/F,Vélizy-Villacoublay (78),Altran,None,"Présents dans tous les métiers de l'ingénierie des systèmes embarqués, nous couvrons l'ensemble des besoins du cycle de vie d'un produit à tous les niveaux d…"
SOFTWARE ENGINEER F/M,Sèvres (92),NanoXplore,None,NanoXplore is a pioneer in design and development of space-grade FPGA and e-FPGA located in Paris and.
ASIC/FPGA Digital Designer,Paris (75),IC Resources,None,"Salary: €35,000 to €75,000 with excellent benefits."
Stage ingénieur traitement du signal H/F,Les Ulis (91),Safran,None,"Safran est un groupe international de haute technologie opérant dans les domaines de la propulsion et des équipements aéronautiques, de l'espace et de la…"
Ingénieur(e) Test Produits F/H,Buc (78),Maud GERGONE,None,"Après avoir analysé les besoins des clients, tant internes qu’externes, vous aurez en charge :"
R&D Project Manager,Évry (91),REFLEX CES,None,A la recherche d’un nouveau challenge ?
Stage Etude et simulation d'algorithmes de communication optique en espace libre H/F,Les Ulis (91),Safran,None,"Safran est un groupe international de haute technologie opérant dans les domaines de la propulsion et des équipements aéronautiques, de l'espace et de la…"
INGENIEUR HARDWARE FPGA EXPERIMENTE F/H,Élancourt (78),MILESYS,None,Votre mission sera de prendre en charge le développement de cartes électroniques numériques à base de FPGA :
Ingénieur électronique HW H/F,Puy-de-Dôme,AKKA TECHNOLOGIES,None,"Dans le cadre du développement de ses activités le groupe Akka recherche pour son agence de Clermont-Ferrand , un ingénieur électronique hardware (H/F) :"
Dévops (C/C++),Clamart (92),SOGETEK INFORMATIQUE,34000,Depuis plus de 33 ans SOGETEK Informatique développe son savoir-faire dans l’informatique industrielle et technique.
Architecte - Senior designer FPGA,Paris (75),Sept Lieues,45000,PME jeune et dynamique en forte croissance sur les marchés français et international.
Développeur Java Full Stack F/H,Clamart (92),SOGETEK INFORMATIQUE,None,Depuis plus de 33 ans SOGETEK Informatique développe son savoir-faire dans l’informatique industrielle et technique.
ingénieur électronique,Sablé-sur-Sarthe (72),Wabtec,None,"Wabtec Corporation is a leading global provider of equipment, systems, digital solutions and value-added services for freight and transit rail."
Développement Python-3 H/F,Clamart (92),Sogetek,None,SOGETEK Informatique développe son savoir-faire dans l’informatique industrielle et technique.
[Technologies] Ingénieur Electronique (H/F),Paris (75),Meritis Technologies,None,Ce poste est-il fait pour vous ?
Ingénieur Pilotage Convertisseurs de Puissance,Séméac (65),ALSTOM,None,Nous créons des innovations intelligentes pour relever les défis de la mobilité d’aujourd'hui et de demain.
STAGE ELECTRONIQUE – REALISATION D’UN CONVERTISSEUR DC-DC F/H,Cornebarrieu (31),SERMA INGENIERIE,None,"Au sein du bureau d’étude électronique de SERMA INGENIERIE, vous participerez à la conception, à la documentation et au test d’un prototype de convertisseur DC…"
Ingénieur électronique FPGA H/F — MBL,Pessac (33),SERMA INGENIERIE,None,Vous participerez au développement de FPGA en étant en charge de :
Ingénieur Développeur VHDL F/H,Versailles (78),Triskell Consulting,40000,"Dans le cadre de ses activités de prestations intellectuelles, Triskell consulting recrute pour l’un de ses clients, un Ingénieur Développeur VHDL.."
Digital Verification Engineer,Paris (75),SCALINX,None,Job Title Digital IC verification engineer.
Ingénieur en Electronique de Puissance H/F,Toulouse (31),CEA - Commissariat à l'Energie Atomique,None,"Au sein de l’entité du CEA Tech Occitanie basée à Toulouse-Labège, la Plateforme Puissance mène des projets applicatifs en lien avec ses partenaires industriels…"
Ingénieur conception carte numérique - CLZ F/H,Guyancourt (78),Groupe SERMA,None,"Intégrer le Groupe SERMA c'est intégrer un groupe en forte croissance, bénéficiant de 30 ans d'expérience en électronique."
Ingénieur commercial - 102020/PSB/SCH,Rennes (35),SERMA INGENIERIE,None,"Afin de poursuivre le développement du groupe SERMA en Bretagne, nous recherchons un Ingénieur Commercial F/H."
Ingénieur Conception Electronique Hardware F/H,Cergy (95),LHERITIER,None,Notre société qui conçoit et fabrique des caméras vidéo souhaite renforcer ses compétences Hardware Électronique Vidéo.
Alternance en conception électronique Aix-En-Provence (H/F),Aix-en-Provence (13),Atos,None,Atos est un leader international de la transformation digitale avec 110 000 collaborateurs dans 73 pays et un chiffre d’affaires annuel de 12 milliards d’euros.
PCB DESIGN ENGINEER F/M,Sèvres (92),NanoXplore,None,NanoXplore is a pioneer in design and development of space-grade FPGA and e-FPGA located in Paris.
Développement d'un système d'acquisition à base de FPGA/SoC-μblaze M/F,Crolles (38),STMicroelectronics,None,Développement d'un système d'acquisition à base de FPGA/SoC-μblaze M/F.
Ingénieur logiciel – Chef de projet banc de test H/F,Vélizy-Villacoublay (78),Altran,None,"La division Aeronautics, Spatial & Defence - Railway (ASD-R) de la région Ile-de-France intervient dans quatre grands domaines : l’aéronautique, le spatial, la…"
Ingénieur Développement logiciel Labview H/F,Achères (78),EMC France,None,"Dans le cadre de notre développement, au sein de notre Business Unit Bancs de test et sous la Responsabilité du Responsable du Bureau d'études, vous intervenez…"
Développement Python-3 H/F,Clamart (92),Sogetek,None,SOGETEK Informatique développe son savoir-faire dans l’informatique industrielle et technique.
Ingénieur FPGA H/F,Nantes (44),Altran,None,Vous êtes un ingénieur FPGA et vous recherchez un nouveau challenge professionnel ?
Ingénieur Conception FPGA Expérimenté H/F,Paris (75),EPSILON ALCEN,20000,Ingénieur conception fpga: 4 ans (Souhaité).
Ingénieur FPGA,Paris (75),Sept Lieues,45000,Société de semi-conducteurs spécialisée dans le domaine dans les technologies inspirées du cerveau.
Ingénieur de développement logiciel C++ F/H,Clamart (92),SOGETEK INFORMATIQUE,30000,Depuis plus de 33 ans SOGETEK Informatique développe son savoir-faire dans l’informatique industrielle et technique.
ingénieur logiciel embarqué F/H,Valence (26),ENGENEO,None,"Notre client, spécialisé en conception et production d'équipements et de systèmes dans le domaine aéronautique, recrute un(e) ingénieur(e) Logiciel Embarqué."
Ingénieur FPGA Traitement Vidéo,Paris (75),Sept Lieues,40000,"PME française de près de 30 ans d'existence, présente à l'international."
Ingénieur FPGA expérimenté H/F,Île-de-France,Ametra,None,"Fort de ses 40 années d’expérience, le Groupe AMETRA accompagne aujourd’hui ses clients, de la conception à l’intégration d’équipements industriels innovants,…"
Concepteur /Conceptrice de cartes electroniques (H/F),Le Pradet (83),Pôle Emploi,2500,"Au sein d'un bureau d'études expert en acquisition de données et mesures physiques,traitement temps-réel du signal et de l'image, études & développements en…"
Responsable Pôle FPGA,Gennevilliers (92),Sept Lieues,45000,"Leader mondial des technologies de sûreté et de sécurité pour les marchés de l’Aérospatial, du Transport, de la Défense et de la Sécurité, ce client bénéficie d…"
Ingénieur conception & développement cartes électroniques H/F,Gières (38),BLUE ORTHO,35000,"BLUE ORTHO, filiale de la société EXACTECH, développe et commercialise des systèmes de Chirurgie Augmentée, ou chirurgie assistée par ordinateur pour l…"
Développeur FPGA Sénior H/F Vidéos de pointe,Cergy (95),Easy Partner,60000,"Cette société, située au nord ouest de Paris, conçoit des caméras dont les principales caractéristiques sont :"
Support Electronic Engineer,Évry (91),REFLEX CES,None,A la recherche d’un nouveau challenge ?
Ingénieur validation FPGA. JCU,Lyon (69),SERMA INGENIERIE,None,"Dans le cadre d’un projet aéronautique, nous recherchons un(e) Ingénieur(e) FPGA."
Développement Python-3 H/F,Clamart (92),Sogetek,None,SOGETEK Informatique développe son savoir-faire dans l’informatique industrielle et technique.
Ingénieur conception FPGA Aéronautique (F/H) – Valence (26),Valence (26),SERMA INGENIERIE,None,Nous recherchons à renforcer nos équipes en intégrant un(e) Ingénieur conception FPGA Aéronautique (F/H).
Architecte FPGA/DSP,Toulouse (31),Sept Lieues,35000,"Startup de 50 personnes fondée en 2017, spécialisée dans le secteur du Spatial et des micro-satellites."
Responsable Design Logique ASIC R&D (H/F),Nice (06),Atos,None,Atos est un leader international de la transformation digitale avec plus de 110 000 collaborateurs dans 73 pays et un chiffre d’affaires annuel de plus de 11…
Ingénieur traitement de signal vidéo - Conception FPGA,Paris (75),Sept Lieues,40000,"PME internationale fondée il y a plus de 30 ans, cette entreprise fabrique des équipements dédiés au secteur de l'audiovisuel professionnel."
Ingénieur conception numérique FPGA - ASIC - SoC,Lannion (22),Sept Lieues,40000,Leader Mondial développant des produits de Télécommunications et des Objets connectés.
Ingénieur électronicien numérique H/F,Grenoble (38),Estella Consulting,40000,ESTELLA est une société d’ingénierie en croissance avec 80 collaborateurs en seulement 3 ans !
Alternance en conception electronique Aix-En-Provence (H/F),Aix-en-Provence (13),Atos,None,Atos est un leader international de la transformation digitale avec 110 000 collaborateurs dans 73 pays et un chiffre d’affaires annuel de 12 milliards d’euros.
Hardware & Software Co-Verification Engineer (FPGA Implementation) M/F,Rousset (13),STMicroelectronics,None,Hardware & Software Co-Verification Engineer (FPGA Implementation) M/F.
Techniciens en électronique,Évry (91),REFLEX CES,19440,A la recherche d’un nouveau challenge ?
ANALOG/MIXED-SIGNAL DESIGN ENGINEER F/M,Sèvres (92),NanoXplore,None,NanoXplore is a pioneer in design and development of space-grade FPGA and e-FPGA located in Paris and.
CDI- Ingénieur(e) Développement FPGA M/F,Grenoble (38),STMicroelectronics,None,CDI- Ingénieur(e) Développement FPGA M/F.
SGO Ingénieur en électronique numérique,Gennevilliers (92),Serma Technologies,None,Besoin pour un projet de conception de carte pour des équipements aéronautiques militaires.
Ingénieur Electronique Analogique/Numérique H/F,Vélizy-Villacoublay (78),Altran,None,"Présents dans tous les métiers de l'ingénierie des systèmes embarqués, nous couvrons l'ensemble des besoins du cycle de vie d'un produit à tous les niveaux d…"
SOFTWARE ENGINEER F/M,Sèvres (92),NanoXplore,None,NanoXplore is a pioneer in design and development of space-grade FPGA and e-FPGA located in Paris and.
ASIC/FPGA Digital Designer,Paris (75),IC Resources,None,"Salary: €35,000 to €75,000 with excellent benefits."
Stage ingénieur traitement du signal H/F,Les Ulis (91),Safran,None,"Safran est un groupe international de haute technologie opérant dans les domaines de la propulsion et des équipements aéronautiques, de l'espace et de la…"
Ingénieur(e) Test Produits F/H,Buc (78),Maud GERGONE,None,"Après avoir analysé les besoins des clients, tant internes qu’externes, vous aurez en charge :"
R&D Project Manager,Évry (91),REFLEX CES,None,A la recherche d’un nouveau challenge ?
Ingénieur(e) Conception FPGA Confirmé(e) H/F,Toulouse (31),LGM Group,None,"LGM Ingénierie, filiale du Groupe LGM (1 400 collaborateurs), est une société spécialisée dans l’étude, la conception, le développement, la qualification et la…"
Ingénieur(e) Développement Logiciel - Toulouse,Toulouse (31),LGM Group,None,"Maintenant que tu as parcouru notre site et bien compris les activités du groupe, voici un focus sur l’entité qui te concerne !"
[STAGE] Développement d'un simulateur de capteur en FPGA pour train autonome - Toulouse,Toulouse (31),LGM Group,None,LGM Ingénierie est une entreprise innovante dans le domaine de l’électronique embarquée et des moyens d’essai.
[STAGE] Développement de briques VHDL sur FPGA H/F - Toulouse,Toulouse (31),LGM Group,None,"Dans le cadre de notre programme de R&T et d’innovation dans l’électronique spatiale, vous développerez des modules VHDL sur une nouvelle famille de FPGA…"
[STAGE] Traitement vidéo embarqué FPGA - Toulouse,Toulouse (31),LGM Group,None,LGM Ingénierie est une entreprise innovante dans le domaine de l’électronique embarquée et des moyens d’essai.
[STAGE] Développement d'un simulateur de capteur en FPGA pour train autonome - Toulouse,Toulouse (31),LGM Group,None,LGM Ingénierie est une entreprise innovante dans le domaine de l’électronique embarquée et des moyens d’essai.
[STAGE] Développement de briques VHDL sur FPGA H/F - Toulouse,Toulouse (31),LGM Group,None,"Dans le cadre de notre programme de R&T et d’innovation dans l’électronique spatiale, vous développerez des modules VHDL sur une nouvelle famille de FPGA…"
Ingénieur(e) Conception FPGA Confirmé(e) H/F,Toulouse (31),LGM Group,None,"LGM Ingénierie, filiale du Groupe LGM (1 400 collaborateurs), est une société spécialisée dans l’étude, la conception, le développement, la qualification et la…"
Stage Etude et simulation d'algorithmes de communication optique en espace libre H/F,Les Ulis (91),Safran,None,"Safran est un groupe international de haute technologie opérant dans les domaines de la propulsion et des équipements aéronautiques, de l'espace et de la…"
Financial Controller,Évry (91),REFLEX CES,None,A la recherche d’un nouveau challenge ?
INGENIEUR HARDWARE FPGA EXPERIMENTE F/H,Élancourt (78),MILESYS,None,Votre mission sera de prendre en charge le développement de cartes électroniques numériques à base de FPGA :
Ingénieur électronique HW H/F,Puy-de-Dôme,AKKA TECHNOLOGIES,None,"Dans le cadre du développement de ses activités le groupe Akka recherche pour son agence de Clermont-Ferrand , un ingénieur électronique hardware (H/F) :"
Dévops (C/C++),Clamart (92),SOGETEK INFORMATIQUE,34000,Depuis plus de 33 ans SOGETEK Informatique développe son savoir-faire dans l’informatique industrielle et technique.
Architecte - Senior designer FPGA,Paris (75),Sept Lieues,45000,PME jeune et dynamique en forte croissance sur les marchés français et international.
Développeur Java Full Stack F/H,Clamart (92),SOGETEK INFORMATIQUE,None,Depuis plus de 33 ans SOGETEK Informatique développe son savoir-faire dans l’informatique industrielle et technique.
ingénieur électronique,Sablé-sur-Sarthe (72),Wabtec,None,"Wabtec Corporation is a leading global provider of equipment, systems, digital solutions and value-added services for freight and transit rail."
[Technologies] Ingénieur Electronique (H/F),Paris (75),Meritis Technologies,None,Ce poste est-il fait pour vous ?
Ingénieur Pilotage Convertisseurs de Puissance,Séméac (65),ALSTOM,None,Nous créons des innovations intelligentes pour relever les défis de la mobilité d’aujourd'hui et de demain.
Ingénieur(e) Développement Logiciel - Toulouse,Toulouse (31),LGM Group,None,"Maintenant que tu as parcouru notre site et bien compris les activités du groupe, voici un focus sur l’entité qui te concerne !"
Techniciens en électronique,Évry (91),REFLEX CES,19440,A la recherche d’un nouveau challenge ?
[STAGE] Traitement vidéo embarqué FPGA - Toulouse,Toulouse (31),LGM Group,None,LGM Ingénierie est une entreprise innovante dans le domaine de l’électronique embarquée et des moyens d’essai.
Expert en sécurité matérielle,Paris (75),ANSSI,None,None
Ingénieur Cybersécurité Embarquée H/F,Gennevilliers (92),Thales Group,None,None
Expert électronique H/F,Le Plessis-Robinson (92),MBDA,None,None
Chef de projet FPGA F/H - 102020/PSR/SOZ,Grenoble (38),Serma Ingénierie,42000,None
Développement Python-3 H/F,Clamart (92),Sogetek,None,None
Ingénieur systèmes embarqués et temps réel F/H,Valbonne (06),SOCIETE POUR L'INFORMATIQUE INDUSTRIELLE,None,None
Ingénieur systèmes embarqués,Wissembourg (67),Bruker,None,None
Ingénieur électronique numérique F/H - 102020/PSR/SOZ,Grenoble (38),Serma Ingénierie,35000,None
Ingénieur Dévelopement Systèmes embarqués Temps Réel,Teillé (44),SERAD,None,None
Développeur Software embarqué C/C++ - Secteur Militaire,Lille (59),Alphadoz,None,None
Firmware/Software Engineer,Sophia Antipolis (06),Maxim Integrated,None,None
INGENIEUR CONCEPTION CARTE NUMERIQUE – CLZ F/H,Guyancourt (78),SERMA INGENIERIE,None,None
Ingénieur hardware confirmé (H/F),Massy (91),RECRUTONS ENSEMBLE,40000,None
Développeur C / C++ & Scrum Master F/H,Clamart (92),SOGETEK INFORMATIQUE,30000,None
Implémentation de commandes type SCPI au sein d’un outil de test NFC,Villeneuve-d'Ascq (59),National Instruments,None,None
Ingénieur(e) Conception FPGA Confirmé(e) H/F,Toulouse (31),LGM Group,None,"LGM Ingénierie, filiale du Groupe LGM (1 400 collaborateurs), est une société spécialisée dans l’étude, la conception, le développement, la qualification et la…"
Techniciens en électronique,Évry (91),REFLEX CES,19440,A la recherche d’un nouveau challenge ?
Ingénieur(e) Développement Logiciel - Toulouse,Toulouse (31),LGM Group,None,"Maintenant que tu as parcouru notre site et bien compris les activités du groupe, voici un focus sur l’entité qui te concerne !"
[STAGE] Traitement vidéo embarqué FPGA - Toulouse,Toulouse (31),LGM Group,None,LGM Ingénierie est une entreprise innovante dans le domaine de l’électronique embarquée et des moyens d’essai.
[STAGE] Développement d'un simulateur de capteur en FPGA pour train autonome - Toulouse,Toulouse (31),LGM Group,None,LGM Ingénierie est une entreprise innovante dans le domaine de l’électronique embarquée et des moyens d’essai.
[STAGE] Développement de briques VHDL sur FPGA H/F - Toulouse,Toulouse (31),LGM Group,None,"Dans le cadre de notre programme de R&T et d’innovation dans l’électronique spatiale, vous développerez des modules VHDL sur une nouvelle famille de FPGA…"
PCB DESIGN ENGINEER F/M,Sèvres (92),NanoXplore,None,NanoXplore is a pioneer in design and development of space-grade FPGA and e-FPGA located in Paris.
Développement d'un système d'acquisition à base de FPGA/SoC-μblaze M/F,Crolles (38),STMicroelectronics,None,Développement d'un système d'acquisition à base de FPGA/SoC-μblaze M/F.
Ingénieur logiciel – Chef de projet banc de test H/F,Vélizy-Villacoublay (78),Altran,None,"La division Aeronautics, Spatial & Defence - Railway (ASD-R) de la région Ile-de-France intervient dans quatre grands domaines : l’aéronautique, le spatial, la…"
Ingénieur Développement logiciel Labview H/F,Achères (78),EMC France,None,"Dans le cadre de notre développement, au sein de notre Business Unit Bancs de test et sous la Responsabilité du Responsable du Bureau d'études, vous intervenez…"
Ingénieur FPGA H/F,Nantes (44),Altran,None,Vous êtes un ingénieur FPGA et vous recherchez un nouveau challenge professionnel ?
Ingénieur Conception FPGA Expérimenté H/F,Paris (75),EPSILON ALCEN,20000,Ingénieur conception fpga: 4 ans (Souhaité).
Ingénieur FPGA,Paris (75),Sept Lieues,45000,Société de semi-conducteurs spécialisée dans le domaine dans les technologies inspirées du cerveau.
Ingénieur de développement logiciel C++ F/H,Clamart (92),SOGETEK INFORMATIQUE,30000,Depuis plus de 33 ans SOGETEK Informatique développe son savoir-faire dans l’informatique industrielle et technique.
ingénieur logiciel embarqué F/H,Valence (26),ENGENEO,None,"Notre client, spécialisé en conception et production d'équipements et de systèmes dans le domaine aéronautique, recrute un(e) ingénieur(e) Logiciel Embarqué."
Ingénieur FPGA Traitement Vidéo,Paris (75),Sept Lieues,40000,"PME française de près de 30 ans d'existence, présente à l'international."
Techniciens en électronique,Évry (91),REFLEX CES,19440,A la recherche d’un nouveau challenge ?
Ingénieur(e) Conception FPGA Confirmé(e) H/F,Toulouse (31),LGM Group,None,"LGM Ingénierie, filiale du Groupe LGM (1 400 collaborateurs), est une société spécialisée dans l’étude, la conception, le développement, la qualification et la…"
Ingénieur(e) Développement Logiciel - Toulouse,Toulouse (31),LGM Group,None,"Maintenant que tu as parcouru notre site et bien compris les activités du groupe, voici un focus sur l’entité qui te concerne !"
[STAGE] Traitement vidéo embarqué FPGA - Toulouse,Toulouse (31),LGM Group,None,LGM Ingénierie est une entreprise innovante dans le domaine de l’électronique embarquée et des moyens d’essai.
[STAGE] Développement d'un simulateur de capteur en FPGA pour train autonome - Toulouse,Toulouse (31),LGM Group,None,LGM Ingénierie est une entreprise innovante dans le domaine de l’électronique embarquée et des moyens d’essai.
[STAGE] Développement de briques VHDL sur FPGA H/F - Toulouse,Toulouse (31),LGM Group,None,"Dans le cadre de notre programme de R&T et d’innovation dans l’électronique spatiale, vous développerez des modules VHDL sur une nouvelle famille de FPGA…"
STAGE 2021 - Développement d’un système de fichiers flash pour satellites (h/f),Paris (75),Airbus,None,Airbus Defence and Space SAS.
Ingénieur logiciel embarqué DNP H/F CDI,Les Ulis (91),LUMIBIRD,None,"Le groupe Lumibird, leader français pour la fabrication de Lasers à solide, lasers à fibre et diodes lasers pour des applications dans la recherche scientifique…"
Concepteur /Conceptrice de cartes electroniques (H/F),Le Pradet (83),Pôle Emploi,2500,"Au sein d'un bureau d'études expert en acquisition de données et mesures physiques,traitement temps-réel du signal et de l'image, études & développements en…"
Responsable Pôle FPGA,Gennevilliers (92),Sept Lieues,45000,"Leader mondial des technologies de sûreté et de sécurité pour les marchés de l’Aérospatial, du Transport, de la Défense et de la Sécurité, ce client bénéficie d…"
Ingénieur conception & développement cartes électroniques H/F,Gières (38),BLUE ORTHO,35000,"BLUE ORTHO, filiale de la société EXACTECH, développe et commercialise des systèmes de Chirurgie Augmentée, ou chirurgie assistée par ordinateur pour l…"
Développeur FPGA Sénior H/F Vidéos de pointe,Cergy (95),Easy Partner,60000,"Cette société, située au nord ouest de Paris, conçoit des caméras dont les principales caractéristiques sont :"
Support Electronic Engineer,Évry (91),REFLEX CES,None,A la recherche d’un nouveau challenge ?
Ingénieur validation FPGA. JCU,Lyon (69),SERMA INGENIERIE,None,"Dans le cadre d’un projet aéronautique, nous recherchons un(e) Ingénieur(e) FPGA."
Ingénieur conception FPGA Aéronautique (F/H) – Valence (26),Valence (26),SERMA INGENIERIE,None,Nous recherchons à renforcer nos équipes en intégrant un(e) Ingénieur conception FPGA Aéronautique (F/H).
Architecte FPGA/DSP,Toulouse (31),Sept Lieues,35000,"Startup de 50 personnes fondée en 2017, spécialisée dans le secteur du Spatial et des micro-satellites."
Ingénieur Conception FPGA Expérimenté,Grenoble (38),SERMA INGENIERIE,None,"Dans le cadre du développement de nos activités, nous recrutons un(e) Ingénieur Conception FPGA expérimenté (F/H)."
