Title,Location,Company,Salary_per_year,Summary
Ingénieur(e) Vérification Emulation ASIC /FPGoC (H/F),Toulouse (31),Derichebourg Aeronautics Recruitment,None,"Nous recherchons pour notre client, un groupe international opérant dans les domaines de l'aérospatial un Ingénieur Vérification Emulation ASIC/FPGA/SoC H/F."
INGENIEUR SIMULATION EMULATION ASIC H/F,Toulouse (31),FORCE INTERIM,None,La société FORCE INTERIM accompagne des donneurs d’ordres de tout secteur et est spécialisée dans le domaine du travail temporaire et du recrutement.
Développeur Back-end (NodeJS) - H/F,Paris 11e (75),Sport Heroes,50000,Kubernetes / Docker / Aws / Mongodb / Nodejs.
Ingénieur(e) Conception FPGA,Toulouse (31),LGM,None,"LGM Ingénierie, filiale du Groupe LGM (1 400 collaborateurs), est une société spécialisée dans l’étude, la conception, le développement, la qualification et la…"
Doctorant conception et caractérisation ASIC pour l'expérience CMS HGCAL (H/F),Palaiseau (91),CNRS,25620,Assurez-vous que votre profil candidat soit correctement renseigné avant de postuler.
Ingénieur(e) Effets Radiation H/F,Buc (78),3D PLUS SA,None,"3D PLUS est une société française de 270 personnes basée en Ile de France, en forte croissance depuis 1995, et réalisant plus de 90% de son chiffre d'affaires à…"
Ingénieur(e) Conception Electronique Numérique H/F,Buc (78),3D PLUS SA,None,"3D PLUS est une société française de 270 personnes basée en Ile de France, en forte croissance depuis 1995, et réalisant plus de 90% de son chiffre d'affaires à…"
Manager / Superviseur Magasin Ile de France,Paris (75),ASICS,23004,Rattachement hiérarchique : Responsable de Magasin.
manager,Paris (75),asics,24000,"Vous aimez le sport, avez de l’expérience en management, vous secondez le Responsable de magasin dans l’ensemble de ses missions."
Concepteur FPGA H/F,Le Plessis-Robinson (92),MBDA,None,"MBDA, au cœur de notre défense… Rejoignez notre groupe, leader européen dans la conception, la fabrication et la commercialisation de missiles et de systèmes d…"
INGENIEUR EN SECURITE DE L’INFORMATION JUNIOR (H/F),Paris (75),Airbus,None,"Airbus is a global leader in aeronautics, space and related services."
Ingénieur design électronique VHDL FPGA pour équipements spatiaux (h/f),Paris (75),Airbus,None,Airbus Defence and Space SAS.
ASIC DFT Synthesis Engineer,Paris (75),Sequans,None,"In the BB IC team, you will be responsible for writing timing constraints, running synthesis and implementing DFT (including scan, MBIST and IP testing) of part…"
INGENIEUR EN SECURITE DE L’INFORMATION JUNIOR (H/F),Les Mureaux (78),APSYS Airbus,None,Date de début : 29-09-2020.
ASIC Verification Expert - BDS R&D (H/F),Les Clayes-sous-Bois (78),Atos,None,Atos est un leader international de la transformation digitale avec 110 000 collaborateurs dans 73 pays et un chiffre d’affaires annuel de 12 milliards d’euros.
INGENIEUR SIMULATION EMULATION ASIC H/F,Toulouse (31),FORCE INTERIM,None,La société FORCE INTERIM accompagne des donneurs d’ordres de tout secteur et est spécialisée dans le domaine du travail temporaire et du recrutement.
Développeur Back-end (NodeJS) - H/F,Paris 11e (75),Sport Heroes,50000,Kubernetes / Docker / Aws / Mongodb / Nodejs.
Asic Verification Environment Engineer,Paris (75),Sequans,None,"Working within Sequans’ ASIC verification environment team, this role includes responsibility for the development of verification environments for the…"
Responsable Design Logique ASIC R&D (H/F),Nice (06),Atos,None,Atos est un leader international de la transformation digitale avec plus de 110 000 collaborateurs dans 73 pays et un chiffre d’affaires annuel de plus de 11…
Ingénieur – Conception VHDL F/H,Châtillon (92),VITEC,None,"Dans le département Hardware de VITEC, vous intègrerez l’équipe de conception VHDL, qui a pour mission de spécifier, concevoir, intégrer et vérifier les IP VHDL…"
Expert Layout/PCB (H/F),Les Clayes-sous-Bois (78),Atos,None,Atos est un leader international de la transformation digitale avec 110 000 collaborateurs dans 73 pays et un chiffre d’affaires annuel de 12 milliards d’euros.
Expert Electronique Layout/PCB (H/F),Les Clayes-sous-Bois (78),Atos,None,Atos est un leader international de la transformation digitale avec 110 000 collaborateurs dans 73 pays et un chiffre d’affaires annuel de 12 milliards d’euros.
Digital ASIC Designer F/H,Montbonnot-Saint-Martin (38),BREAM & LAANAIA,None,"Fondée en 2007 à Grenoble, l'entreprise développe des circuits intégrés avec une technologie innovante pour les applications sécurisées: paiement bancaire,…"
ASIC CAD/IT Engineer,France,Sequans,None,Working within a dynamic design team you will participate in the development of next generation ASIC products for 4G and 5G wireless communication networks.
Design leader et spécialiste ASIC (F/H),Gennevilliers (92),Thales Group,None,"Thales propose des systèmes d’information et de communication sécurisés et interopérables pour les forces armées, les forces de sécurité et les opérateurs d…"
INGENIEUR SIMULATION EMULATION ASIC F/H,Toulouse (31),SAS FORCE INTERIM,None,"Nous recherchons pour l'un de nos clients basé sur TOULOUSE, un(e) Ingénieur simulation/émulation ASIC h/f."
Mixed-Signal ASIC project manager,Paris (75),SCALINX,None,Job Title Mixed-Signal ASIC project manager.
Ingénieur(e) Effets Radiation H/F,Buc (78),3D PLUS SA,None,"3D PLUS est une société française de 270 personnes basée en Ile de France, en forte croissance depuis 1995, et réalisant plus de 90% de son chiffre d'affaires à…"
Ingénieur(e) Conception FPGA,Toulouse (31),LGM,None,"LGM Ingénierie, filiale du Groupe LGM (1 400 collaborateurs), est une société spécialisée dans l’étude, la conception, le développement, la qualification et la…"
Ingénieur(e) Vérification Emulation ASIC /FPGoC (H/F),Toulouse (31),Derichebourg Aeronautics Recruitment,None,"Nous recherchons pour notre client, un groupe international opérant dans les domaines de l'aérospatial un Ingénieur Vérification Emulation ASIC/FPGA/SoC H/F."
Ingénieur FPGA F/H,Fontenay-aux-Roses (92),Groupe AMETRA,None,Pour renforcer notre BE spécialisé en intégration système et développer notre pôle FPGA.
Ingénieur FPGA H/F,Palaiseau (91),GROUPE CENTUM ADETEL,None,"Depuis plus de 25 ans, CENTUM ADENEO apporte conseil et expertise à ses clients dans le domaine de l’électronique embarqué."
ASIC Design Engineer,Paris (75),IC Resources,None,Salary: Competitive Salary and benefits Package + City location.
Ingénieur.e Conception détaillée ASIC – H/F,Toulouse (31),Thales Group,None,"Acteur spatial mondialement reconnu dans les domaines des télécommunications, de la navigation, de l’observation de la terre, de l’exploration et de la…"
Ingénieur Vérification ASIC/ SoC F/H,Sophia Antipolis (06),CELAD,40000,Ingénieur vérification asic/ soc f/h ou similaire: 1 an (Souhaité).
Ingenieur Verification ASIC,Sophia Antipolis (06),DATACORP,35000,"Pour accompagner notre croissance, nous recrutons un Ingénieur Vérification ASIC."
Ingénieur(e) Conception Electronique Numérique F/H,Buc (78),Maud GERGONE,None,"Au sein de l’équipe Design Numérique, vos principales missions seront les suivantes :"
Digital IC designer,Paris (75),SCALINX,None,Job Title Digital IC design engineer.
Ingénieur Développement ASIC,Gennevilliers (92),Sept Lieues,40000,"Leader mondial des technologies de sûreté et de sécurité pour les marchés de l’Aérospatial, du Transport, de la Défense et de la Sécurité, ce client bénéficie d…"
Engineering Internship,Sophia Antipolis (06),Arm,None,"We are an Equal Opportunity Employer and do not discriminate against any employee or applicant for employment because of race, color, sex, age, national origin,…"
ASIC/FPGA Digital Designer,Paris (75),IC Resources,None,"Salary: €35,000 to €75,000 with excellent benefits."
Ingénieur Vérification SoC - IP ASIC H/F,Sophia Antipolis (06),CELAD,40000,Ingénieur vérification soc - ip asic h/f ou similaire: 5 ans (Requis).
Ingénieur ASIC (H/F),Sophia Antipolis (06),Groupe SII,32000,Nous recherchons pour notre agence de Sophia Antipolis un Ingénieur ASIC.
Digital ASIC Design Engineer,Grenoble (38),IC Resources,None,Salary: Fantastic benefits + competitive salary.
[Technologies] Ingénieur Electronique (H/F),Paris (75),Meritis Technologies,None,Ce poste est-il fait pour vous ?
Digital ASIC Design Engineer,Grenoble (38),IC Resources,None,Salary: Fantastic benefits + competitive salary.
[Technologies] Ingénieur Electronique (H/F),Paris (75),Meritis Technologies,None,Ce poste est-il fait pour vous ?
Digital Verification Engineer,Paris (75),SCALINX,None,Job Title Digital IC verification engineer.
Verification Engineer SoC - IP ASIC,Sophia Antipolis (06),CELAD,40000,Verification engineer soc - ip asic ou similaire: 3 ans (Requis).
LTE Algorithm Senior Engineer,Sophia Antipolis (06),Sequans,None,The Algorithm Senior Engineer is responsible for designing and specifying new architectures/algorithms for the physical layer of wireless products.
Chef de Secteur Sell Out Sport Running H/F,Rennes (35),Magnitude,None,Nous recrutons pour l’un de nos clients un Brand Trainer Sport - Running capable de booster la visibilité d’une marque leader sur le marché du Running auprès…
User care & QA Specialist,Paris 11e (75),Sport Heroes Group,None,"Dans un monde de plus en plus sédentaire, nous pensons que le sport est un outil pour améliorer le bien-être et la santé du plus grand nombre."
Ingénieur Vérification SoC - IP ASIC,Lannion (22),Sept Lieues,40000,Leader Mondial développant des produits de Télécommunications et des Objets connectés.
Physical Design Engineer,Paris (75),SCALINX,None,Job Title Physical design engineer.
Ingénieur conception numérique FPGA - ASIC - SoC,Lannion (22),Sept Lieues,40000,Leader Mondial développant des produits de Télécommunications et des Objets connectés.
CDI - Ingénieur(e) expérimenté(e) en électronique numérique (H/F),Les Mureaux (78),Ariane Group,None,"Le département ""Electrical Equipment Software and Support"" développe et maintien des moyens matériels et logiciels pour la mise en œuvre électriques et le…"
FPGA/ASIC Digital Design Engineer,Sophia Antipolis (06),IC Resources,None,"Salary: €30,000 to €50,000."
Ingénieur.e Vérification ASIC/FPGA complexe – H/F,Toulouse (31),Thales Group,None,"Acteur spatial mondialement reconnu dans les domaines des télécommunications, de la navigation, de l’observation de la terre, de l’exploration et de la…"
Product Engineer Manager,Meylan (38),Dolphin Design,None,"En tant qu’ingénieur produit, votre objectif principal est de concevoir la stratégie globale de la chaîne d’approvisionnement et d’en assurer la mise en œuvre…"
Ingénieur développement logiciel embarqué (WiFi) F/H,Biot (06),RivieraWaves,None,"Vous souhaitez intégrer une équipe travaillant sur des technologies de pointe et des projets à haute valeur technique, dans une ambiance sympa en environnement…"
Architect ASIC,Sèvres (92),Sept Lieues,40000,Entreprise pionnière dans le développement et l'intégration d'architecture FPGA à destination des secteurs du spatial et de la défense.
Ingénieur(e) en Microélectronique Spécialisé en STA H/F,Villeneuve-Loubet (06),EASii IC,None,"Dans le cadre de notre croissance sur de nouveaux marchés, vous ferez partie de notre Design House ASIC et Intégré à l’équipe STA, vous aurez en charge des…"
Verification Engineer,Paris (75),IC Resources,None,"Salary: €40,000 - €60,000."
Ingénieur en traitement du signal pour les communications numériques F/H,Biot (06),RivieraWaves,None,"Au sein du groupe Wireless Internet of Things, vous serez membre de notre équipe Algorithmes travaillant en étroite collaboration avec nos équipes HW, SW et RF…"
Ingénieur Cybersécurité Embarquée H/F,Gennevilliers (92),Thales Group,None,"Thales propose des systèmes d’information et de communication sécurisés et interopérables pour les forces armées, les forces de sécurité et les opérateurs d…"
Ingénieur(e) en Conception Numérique - DFT H/F,Villeneuve-Loubet (06),EASii IC,None,"Au sein de l’équipe DFT, vous aurez pour mission d’intégrer la DFT sur des ASICs digitaux/mixtes :"
Ingénieur(e) Conception ASIC/FPGA (H/F),Toulouse (31),Thales Group,None,"Acteur spatial mondialement reconnu dans les domaines des télécommunications, de la navigation, de l’observation de la terre, de l’exploration et de la…"
Ingénieur Design ASIC/FPGA Junior/Senior,Aix-en-Provence (13),Sept Lieues,40000,"Entreprise internationale innovante dans le domaine des interfaces à haut débit (PCIe, Gen-Z…)."
Ingénieur Electronique - Tests et Validation F/H,Lyon 1er (69),MCA INGENIERIE,None,"Au sein du département, vous intégrez une équipe projet intervenant en test et validation."
Ingénieur.e Vérification FPGA/ASIC numérique complexe (H/F),Toulouse (31),Thales Group,None,"Acteur spatial mondialement reconnu dans les domaines des télécommunications, de la navigation, de l’observation de la terre, de l’exploration et de la…"
Ingénieur expérimenté conception FPGA/ASIC H/F,Toulouse (31),Expleo,None,"Expleo propose une offre unique de services intégrés d'ingénierie, qualité et conseil stratégique pour la transformation digitale."
Ingénieur(e) Layout Analogique H/F,Grenoble (38),EASii IC,None,"Dans le cadre de notre croissance, nous recherchons des ingénieurs Layout Analogique, pour participer à des projets au sein de notre centre de design…"
Ingénieur.e Vérification ASIC/SoC H/F,Sophia Antipolis (06),CELAD,None,"Avec plus de 25 ans d’existence, CELAD est une société de conseil et d’ingénierie informatique de plus de 1300 collaborateurs au CA approchant les 100 millions…"
DIGITAL DESIGN ENGINEER F/M,Sèvres (92),NanoXplore,None,NanoXplore is a pioneer in design and development of space-grade FPGA and e-FPGA located in Paris and.
FPGA Digital Design Engineer,Sophia Antipolis (06),IC Resources,None,"Salary: €50,000- €80,000 with excellent benefits."
Ingénieur(e) en Conception Numérique RTL H/F,Grenoble (38),EASii IC,None,Prendre en charge la conception d'IPS et ou de SOC/ASICS digital/mixtes. :
Silicon validation engineer,Caen (14),SCALINX,None,Job Title Silicon validation engineer.
Ingénieur(e) en Implémentation Physique H/F,Villeneuve-Loubet (06),EASii IC,None,"Intégré(e) au sein de l’équipe d’Implémentation physique numérique de notre Design House ASIC, vous aurez en charge tout ou partie de l’implémentation physique …"
Lead Application Engineer SCBU,France,ANSYS,None,"Ansys is the global leader in engineering simulation, helping the world's most innovative companies deliver radically better products to their customers."
INGENIEUR(E) EN MICROELECTRONIQUE SPECIALISE(E) en STA F/H,Grenoble (38),EASII IC SAS,None,"Dans le cadre de notre croissance sur de nouveaux marchés, vous ferez partie de notre Design House ASIC et intégrerez l’équipe d'analyse statique de timing (STA…"
Ingénieur traitement du signal – 092020/PST/SCH,Toulouse (31),SERMA INGENIERIE,None,"Dans le cadre d’un projet lié au secteur spatial, nous recherchons un(e) Ingénieur(e) Traitement du signal Modem (F/H)."
RESPONSABLE TECHNIQUE – CONCEPTION / DESIGN HARDWARE F/H,Nice (06),Progressive,None,RESPONSABLE TECHNIQUE - CONCEPTION / DESIGN HARDWARE.
Project Manager,Meylan (38),Dolphin Design,None,"En tant que chef de projet, vous êtes garant de mener tout projet en conformité avec les objectifs de départ donnés par l’entreprise en suivant les feuilles de…"
Graduate Physical Implementation Engineer,Sophia Antipolis (06),Arm,None,"We are an Equal Opportunity Employer and do not discriminate against any employee or applicant for employment because of race, color, sex, age, national origin,…"
Digital IC Design Team Leader,Paris (75),SCALINX,None,Job Title Digital IC Design Team Leader.
Internship : Improvement of an electrical simulation tool,Meylan (38),Dolphin Design,None,"Basé en région grenobloise, le stage proposé s’intègre au sein de l’équipe CAD qui supporte les équipes de développement de Dolphin."
Chef de projet en microélectronique H/F,Meylan (38),DOLPHIN DESIGN,None,"Dolphin Design, connu précédemment sous le nom de Dolphin Integration, est une PME dans le domaine du semi-conducteur, employant 160 personnes dont 140…"
Ingénieur Design Analogique RF H/F,Montpellier (34),Klanik,None,Niveau d’expérience : 5-8 ans.
IC DIGITAL BACKEND ENGINEER F/M,Sèvres (92),NanoXplore,None,NanoXplore is a pioneer in design and development of space-grade FPGA and e-FPGA located in Paris and.
Digital IC Design Lead,Paris (75),IC Resources,None,Excellent salary + competitive benefits!
Ingénieur expérimenté conception FPGA/ASIC H/F,Toulouse (31),Expleo,None,"Expleo propose une offre unique de services intégrés d'ingénierie, qualité et conseil stratégique pour la transformation digitale."
Ingénieur(e) Layout Analogique H/F,Grenoble (38),EASii IC,None,"Dans le cadre de notre croissance, nous recherchons des ingénieurs Layout Analogique, pour participer à des projets au sein de notre centre de design…"
Ingénieur.e Vérification ASIC/SoC H/F,Sophia Antipolis (06),CELAD,None,"Avec plus de 25 ans d’existence, CELAD est une société de conseil et d’ingénierie informatique de plus de 1300 collaborateurs au CA approchant les 100 millions…"
DIGITAL DESIGN ENGINEER F/M,Sèvres (92),NanoXplore,None,NanoXplore is a pioneer in design and development of space-grade FPGA and e-FPGA located in Paris and.
FPGA Digital Design Engineer,Sophia Antipolis (06),IC Resources,None,"Salary: €50,000- €80,000 with excellent benefits."
Ingénieur(e) en Conception Numérique RTL H/F,Grenoble (38),EASii IC,None,Prendre en charge la conception d'IPS et ou de SOC/ASICS digital/mixtes. :
Silicon validation engineer,Caen (14),SCALINX,None,Job Title Silicon validation engineer.
Ingénieur(e) en Implémentation Physique H/F,Villeneuve-Loubet (06),EASii IC,None,"Intégré(e) au sein de l’équipe d’Implémentation physique numérique de notre Design House ASIC, vous aurez en charge tout ou partie de l’implémentation physique …"
Lead Application Engineer SCBU,France,ANSYS,None,"Ansys is the global leader in engineering simulation, helping the world's most innovative companies deliver radically better products to their customers."
INGENIEUR(E) EN MICROELECTRONIQUE SPECIALISE(E) en STA F/H,Grenoble (38),EASII IC SAS,None,"Dans le cadre de notre croissance sur de nouveaux marchés, vous ferez partie de notre Design House ASIC et intégrerez l’équipe d'analyse statique de timing (STA…"
INGENIEUR SIMULATION EMULATION ASIC H/F,Toulouse (31),FORCE INTERIM,None,La société FORCE INTERIM accompagne des donneurs d’ordres de tout secteur et est spécialisée dans le domaine du travail temporaire et du recrutement.
Ingénieur(e) Vérification Emulation ASIC /FPGoC (H/F),Toulouse (31),Derichebourg Aeronautics Recruitment,None,"Nous recherchons pour notre client, un groupe international opérant dans les domaines de l'aérospatial un Ingénieur Vérification Emulation ASIC/FPGA/SoC H/F."
Ingénieur(e) Conception FPGA Confirmé(e) H/F,Toulouse (31),LGM Group,None,"LGM Ingénierie, filiale du Groupe LGM (1 400 collaborateurs), est une société spécialisée dans l’étude, la conception, le développement, la qualification et la…"
Ingénieur(e) Conception FPGA H/F - Toulouse,Toulouse (31),LGM Group,None,"LGM Ingénierie, filiale du Groupe LGM (1 400 collaborateurs), est une société spécialisée dans l’étude, la conception, le développement, la qualification et la…"
Digital HW Verification & Design Engineer,Valbonne (06),NXP Semiconductors,None,"(NASDAQ: NXPI) enables secure connections and infrastructure for a smarter world, advancing solutions that make lives easier, better, and safer."
Ingénieur FPGA expérimenté H/F,Île-de-France,Ametra,None,"Fort de ses 40 années d’expérience, le Groupe AMETRA accompagne aujourd’hui ses clients, de la conception à l’intégration d’équipements industriels innovants,…"
Ingénieur Traitement du Signal Modem F/H — 092020/PST/KQN,Toulouse (31),SERMA INGENIERIE,None,"Dans le cadre du développement de nos activités, nous recrutons un(e) Ingénieur(e) Traitement du signal Modem (F/H)."
Ingénieur Test et Validation Electronique- Tours F/H,Tours (37),MCA GROUPE,None,"Au sein du département ferroviaire, vous intégrez une équipe projet intervenant en test et validation."
Ingénieur(e) conception FPGA/ASIC expérimenté(e) H/F H/F,Toulouse (31),Expleo,None,"Expleo propose une offre unique de services intégrés d'ingénierie, qualité et conseil stratégique pour la transformation digitale."
Lead HW Engineer,Sophia Antipolis (06),IC Resources,None,"Salary: €55,000 - €80,000 depending on experience level."
Ingénieur.e Responsable Sous-traitance ASIC/FPGA (WPM) H/F,Toulouse (31),Thales Group,None,"Acteur spatial mondialement reconnu dans les domaines des télécommunications, de la navigation, de l’observation de la terre, de l’exploration et de la…"
Senior Designer ASIC / Architect,Aix-en-Provence (13),Sept Lieues,50000,"Entreprise internationale innovante dans le domaine des interfaces à haut débit (PCIe, Gen-Z…)."
Digital HW Verification Engineer,Caen (14),NXP Semiconductors,None,"(NASDAQ: NXPI) enables secure connections and infrastructure for a smarter world, advancing solutions that make lives easier, better, and safer."
Ingénieur.e conception FPGA/SoC – H/F,Toulouse (31),Thales Group,None,"Acteur spatial mondialement reconnu dans les domaines des télécommunications, de la navigation, de l’observation de la terre, de l’exploration et de la…"
Ingénieur(e) en Conception Numérique - DFT F/H,Sophia Antipolis (06),CELAD,40000,"Au sein de l’équipe de l'équipe de Design, vous aurez pour mission de créer et mettre en place le DFT sur des ASICs digitaux/mixtes :"
Chef de projet en microélectronique H/F,Meylan (38),DOLPHIN DESIGN,None,"Dolphin Design, connu précédemment sous le nom de Dolphin Integration, est une PME dans le domaine du semi-conducteur, employant 160 personnes dont 140…"
Ingénieur.e conception cartes numériques – H/F,Toulouse (31),Thales Group,None,"Acteur spatial mondialement reconnu dans les domaines des télécommunications, de la navigation, de l’observation de la terre, de l’exploration et de la…"
INGENIEUR SUPPORT ENGINEERING EN CARACTERISATION F/H,Grenoble (38),LYNRED,None,"Rattaché(e) au responsable du département Caractérisation et Instrumentation Microbolomètre, votre mission principale sera d'assurer l'expertise technique de la…"
Comptable - Chargé de Reporting H/F,France,ASICS,None,"En tant que marque multisports (ASICS, Onitsuka Tiger, ASICS Tiger), ASICS propose une très belle gamme de chaussures, de vêtements et d'accessoires ; et est l…"
Senior Key Account Manager - Strategic Account (H/F),Lattes (34),Asics,None,"ASICS, acronyme du latin « Anima Sana in Corpore Sano », est le reflet de notre vision et ce en quoi nous croyons."
Ingénieur(e) Conception FPGA Confirmé(e) H/F,Toulouse (31),LGM Group,None,"LGM Ingénierie, filiale du Groupe LGM (1 400 collaborateurs), est une société spécialisée dans l’étude, la conception, le développement, la qualification et la…"
Ingénieur(e) Conception FPGA H/F - Toulouse,Toulouse (31),LGM Group,None,"LGM Ingénierie, filiale du Groupe LGM (1 400 collaborateurs), est une société spécialisée dans l’étude, la conception, le développement, la qualification et la…"
Ingénieur Design et Back-End ASIC F/H,Rennes (35),SECURE-IC SAS,None,"En tant qu'Ingénieur Design et Back-End ASIC (H/F), vous participerez au développement du portefeuille d’IP cores de Secure-IC en assurant les différentes…"
Designer IP Core FPGA / ASIC,Aix-en-Provence (13),Sept Lieues,35000,Startup spécialisée dans la conception d'IP cores FPGA et ASIC complexes.
RTL Design Engineer,Marseille (13),IC Resources,None,"Senior RTL Designer – Beautiful location of Aix-en-Provence, France – Fab Technology!!"
Ingénieur.e Software Embarqué,Paris (75),AnotherBrain,None,AnotherBrain développe une nouvelle génération d’intelligence artificielle : Organic AITM.
Architecte ASIC numérique complexe – H/F,Toulouse (31),Thales Group,None,"Acteur spatial mondialement reconnu dans les domaines des télécommunications, de la navigation, de l’observation de la terre, de l’exploration et de la…"
Digital Implementation Engineer - Sr Staff,France,InvenSense,None,"Founded in 2003, InvenSense Inc., a TDK Group Company, is the world’s leading provider of MEMS sensor platforms."
Digital Designer,Meylan (38),DOLPHIN DESIGN,None,"Dans le cadre de notre accroissement d'activité, au sein de l'équipe ""System Architecture"", nous recrutons un(e) ""concepteur numérique débutant"" (F/H)."
Stage CAD - Informatique H/F,Meylan (38),DOLPHIN DESIGN,None,"Basé en région grenobloise, le stage proposé s’intègre au sein de l’équipe CAD qui supporte les équipes de développement de Dolphin."
Ingénieur Électronique F/H,Cornebarrieu (31),SERMA INGENIERIE,None,"Dans le cadre du développement de nos activités au sein du bureau d’étude électronique de SERMA INGENIERIE, nous recrutons un(e) Ingénieur Electronique (F/H)."
Responsable Pôle FPGA,Gennevilliers (92),Sept Lieues,45000,"Leader mondial des technologies de sûreté et de sécurité pour les marchés de l’Aérospatial, du Transport, de la Défense et de la Sécurité, ce client bénéficie d…"
